Judul,Kelas
"Pramono Anung: Kalau Saya Menang, Buruh Akan Dapat Gubernur yang Gampang Dihubungi",NEWS
"Hasil Mike Tyson Vs Jake Paul: Si Leher Beton Kalah, Bisa Bertahan sampai Ronde 8",BOLA
"Resep Brownies Panggang Kacang Mete, Teman Minum Teh atau Kopi",FOOD
"Hampir Semua Pantai di Kota Semarang Jadi Privat, Agustina-Iswar Tawarkan Wisata Aglomerasi",REGIONAL
"Wilayah Berpotensi Hujan Lebat, Petir, dan Angin Kencang pada 16-21 November 2024",TREN
Takumi Minamino Bicara Timnas Indonesia yang Bertahan Alot,BOLA
"Pria Ini Bersepeda 4.400 Km Selama 100 Hari demi Rujuk dengan Mantan Istri, Pingsan di Jalan dan Akhirnya Dapat Perhatian",GLOBAL
"Tesla Kembali Recall Cybertruck, Total Sudah 6 Kali Tahun Ini",OTOMOTIF
"Bertemu PM Selandia Baru, Prabowo Komitmen Tingkatkan Kerja Sama Dua Negara",NEWS
"Soal Harga Tiket Pesawat, Jubir: Kemenhub Masih Tunggu Rekomendasi Tim Satgas",MONEY
"Truk Serempet Pasutri yang Boncengan Motor di Magelang, Istri Tewas",REGIONAL
"Hadiri Kampanye Ahmad Luthfi di Purwokerto, Jokowi: Saya Datang karena Mendukung",REGIONAL
"Di Depan Buruh, Pramono Anung: Kalau Ada Perusahaan Nakal, Saya Datangi Sendiri",NEWS
Cara Mengaktifkan Ketuk Layar 2 Kali di HP Vivo dengan Mudah dan Praktis,TEKNO
"Kecelakaan ""Speedboat"" di Banyuasin Tewaskan WNA China, Pengemudi Jadi Tersangka karena Positif Narkoba",REGIONAL
Kawasaki Rilis Ninja ZX-25RR Livery WSBK Terbaru,OTOMOTIF
"Ribuan Pengungsi Erupsi Lewotobi Terpapar Penyakit, ISPA dan Hipertensi Paling Banyak",REGIONAL
Penduduk Lisbon Desak Referendum untuk Batasi Sewa Penginapan untuk Liburan,TRAVEL
"Kisah Prof. Rainiyati, 12 Tahun Rampungkan Usaha Jadi Guru Besar Unja",EDUKASI
2.700 Rumah Disiapkan untuk Korban Erupsi Gunung Lewotobi,PROPERTI
Apakah Ubi Jalar Tinggi Karbohidrat? Berikut Penjelasannya…,HEALTH
"Viral, Ivan Sugianto Foto dengan Pamen TNI, Kapuspen Angkat Bicara",TREN
"Kampanye di Lapangan Tegalega, Pasangan Farhan-Erwin Bawa Eskavator",REGIONAL
"Pramono Anung: Sebelum Buruh Demo, Saya Undang Dulu buat Berdialog",NEWS
"Sering Dibilang Mirip, Shegan Menangis Bertemu Lisa BLACKPINK",HYPE
Prabowo dan Presiden Vietnam Bahas Potensi Kerja Sama Capai Target Perdagangan 18 Miliar Dollar AS,NEWS
"Cerita Alumni Telkom University, Ikut Desain Mobil Kepresidenan MV3 Garuda",EDUKASI
Jordi Amat Sebut Timnas Indonesia Harus Lebih Efisien di Depan Gawang,BOLA
"Relawan Andika-Hendi Kecelakaan di Semarang, Mobil sampai Ringsek",REGIONAL
Pemerintah Luncurkan Satgas Jejaring Advokasi Inklusi Keuangan Digital Perempuan,MONEY
"Plus Minus Honda Jazz CVT Bekas, Pahami Sebelum Membeli",OTOMOTIF
"Keliling Naik Jip di Purwokerto, Jokowi Bersama Luthfi Disambut Ribuan Warga",REGIONAL
"Sempat Tolak Perintah Jadi Cagub, Pramono ke Megawati: Tolong Mbak, Jangan Saya...",NEWS
"Atasi Masalah Sampah, Menteri LH Wajibkan Produsen Retail dan Industri Makanan Kelola Daur Ulang",REGIONAL
Umat Islam yang Pilih Trump Kecewa karena Kabinetnya Pro-Israel,GLOBAL
Dugaan Pelanggaran Netralitas ASN di Tapsel Masuk Ranah Hukum,REGIONAL
"Resep Udang Bakar Pedas, Sajikan dengan Sambal Dabu-dabu",FOOD
Mungkinkah Membangun PT Berbasis Filosofi Koperasi?,MONEY
4 Cara Cek Nomor IMEI iPhone,TREN
Rundown Konser Isyana Sarasvati di Istora Senayan Hari Ini,HYPE
"Viral Foto Ivan Sugianto dengan Kolonel, TNI: Hanya Teman, Bukan Beking",NEWS
"Aquabike Jetski World Championship 2024, Penonton Antusias Saksikan Aksi Para Pembalap di Parapat",BOLA
"Edy Klaim Punya Program Pembangunan Jalan di Nias, tapi Dihentikan",REGIONAL
"Sapa Warga Medan dan Semarang, Cek Harga Resmi Mobil Listrik BYD",OTOMOTIF
"Bertemu Presiden Vietnam, Prabowo Siap Percepat Ratifikasi Perjanjian ZEE",NEWS
Francois Medori Juara Dunia Jetski 2024 di Danau Toba,REGIONAL
Ruben Amorim Yakin Bisa Kembalikan Kejayaan Manchester United,BOLA
"Ridwan Kamil Klaim Dapat Dukungan Jokowi, Pramono: Saya dari Rakyat",NEWS
"Harga Bahan Pokok Sabtu 16 November 2024: Mayoritas Naik, Kecuali Daging Sapi Murni",MONEY
"Kawanan Gajah Mengamuk di Lampung, Makan Beras Milik Warga",REGIONAL
Kebakaran RS di India Sebabkan 10 Bayi Baru Lahir Meninggal dan 16 Lainnya Kritis,GLOBAL
5 Hal yang Bisa Dilakukan di Pameran Natasha Tontey Museum MACAN,TRAVEL
"Pacaran dengan Anak di Bawah Umur, Apakah Termasuk Child Grooming?",LIFESTYLE
Kesiapan Guru Jadi Kunci Integrasi Edukasi Mangrove dalam Kurikulum Merdeka di Sumut,NEWS
Kronologi Lansia di Surabaya Bunuh Kakak dan Keponakan Saat Mediasi Soal Rumah Warisan,REGIONAL
"Kesan Pertama Menjajal Oppo Find X8, Nyaman Satu Tangan",TEKNO
"Perkuat “Growth Mindset”, 516 Beswan Djarum Diharapkan Temukan Potensi Diri",EDUKASI
Hyundai Inster EV Disebut Terlalu Mahal buat Indonesia,OTOMOTIF
Pertamina Sebut Pengembangan CCS/CCUS Berkontribusi Signifikan dalam Pengurangan Emisi di Indonesia,NEWS
"Saat Pemerintah Targetkan Harga Tiket Pesawat Turun, tapi Bakal Naik Imbas PPN 12 Persen...",TREN
"Agar Tak Berebut Proyek, Pembagian Tugas BUMN Karya Sesuai Kompetensi",PROPERTI
"Biografi Wahid Hasyim, Menteri Agama Penerima Gelar Pahlawan Nasional",STORI
"5 Rekomendasi Tempat Belanja Bunga di Jakarta, Murah Meriah",HOMEY
"Mendikdasmen Ingin Ada Pramuka Bhayangkara di Sekolah, Apa Itu?",EDUKASI
"Pembangunan Infrastruktur dan Wilayah Jadi Fokus Presiden, Menpan-RB Pastikan Penataan Organisasi Kementerian Terkait Terus Dipacu",NEWS
5 Foto Momen Bom Israel Seberat 907 Kg Jatuh dan Meledak di Apartemen Lebanon,GLOBAL
"Tangguhkan Gelar Doktor Bahlil, UI Akui Harus Lakukan Perbaikan Internal",EDUKASI
Pentingnya Mengganti Filter Udara Mobil Rutin,OTOMOTIF
"Kondisi Fatherless Picu Anak Laki-laki Lakukan Tindak Kejahatan, Kenapa?",LIFESTYLE
"Harga Emas Antam 16 November 2024: Turun Rp 2.000, Simak Rinciannya",MONEY
BRI Hadirkan Kemudahan Investasi Sukuk Tabungan ST013 Melalui BRImo,ADVERTORIAL
Rangkuman Hari Ke-996 Serangan Rusia ke Ukraina: Hasil Telepon Scholz-Putin | Zelensky Optimis dengan Trump,GLOBAL
"Langkah Tegas Perangi Judi Online, BRI Blokir Lebih dari 3.000 Rekening",ADVERTORIAL
Bagaimana Peluang Indonesia Lolos Piala Dunia Setelah Ditekuk Jepang?,TREN
Jalan Tol Tembus Sukabumi Barat pada Kuartal II-2026,PROPERTI
Pelayanan Holistik untuk Pasien Diabetes Cegah Komplikasi,HEALTH
Lisa BLACKPINK Bocorkan Koreografi Lagu Baru Saat Fan Meetup Jakarta,HYPE
Plus Minus Honda Jazz Bekas Generasi Kedua,OTOMOTIF
"Curhat Maria Pilih Tak Mudik ke Kupang: Harga Tiket Pesawat Lebih Murah ke Hong Kong, Kan Pusing...",MONEY
"4 Trik Buat Huruf Arab di WhatsApp untuk Chatting, Mudah",TEKNO
Ahok Tak Masalah Seandainya PDI-P Usung Anies Baswedan Jadi Cagub Jakarta,NEWS
"Tingkatkan Literasi di Malaka, Dompet Dhuafa Kirim Ratusan Buku dan Gelar Seminar bagi Guru",NEWS
"Cerita 2 Profesor Perempuan Unej, Susul Suami Jadi Guru Besar di Fakultas yang Sama",EDUKASI
"Resep Dumpling Daging Sapi, Sajikan dengan Saus",FOOD
Siapa Konsumen yang Pas Beli Hyundai Ioniq 5 N?,OTOMOTIF
"Tanda Love yang Apiti ""Kaka, Mama, Papa"" di Dinding Rumah Jadi Tulisan Terakhir Bocah Korban Pembunuhan di Banyuwangi",REGIONAL
Bahaya Lemak Perut pada Pria,HEALTH
Flyover Djuanda Bikin Harga Jual Rumah di Sidoarjo Naik,PROPERTI
Refleksi Jelang Pilkada Serentak 2024,NEWS
"Kata Media Asing soal Indonesia Vs Jepang, Soroti Insiden Gol Bunuh Diri",TREN
"Link Live Streaming Mike Tyson vs Jake Paul, Duel Terpanas 2024",BOLA
Ahok Ungkap Anies Tak Pernah Masuk Bursa DPP PDI-P untuk Pilkada Jakarta,NEWS
"Istana Garuda, Kantor Setpres, dan TC PSSI di IKN Segera Diresmikan",IKN
Isyana Akan Ajak Penonton Saksikan Kisah Hidupnya lewat Konser Lost In Harmony,HYPE
"Banyak Gen Z Masih Jadi Pengangguran, BCA Beri Beasiswa dan Pelatihan",EDUKASI
Tarif PPN RI Tertinggi Kedua di ASEAN,MONEY
"Yoon Suk-yeol Bertemu Xi Jinping di Sela-sela KTT APEC, Pertama dalam 2 Tahun, Apa yang Dibahas?",GLOBAL
Bukan Ahok yang Tolak Anies Maju pada Pilkada Jakarta,NEWS
"Puji Prabowo, PM Kanada Justin Trudeau: Kepemimpinan Anda Luar Biasa",NEWS
Mitsubishi Fuso Masih Mampu Tahan Gempuran Truk China,OTOMOTIF
"Mendikdasmen: Mapel AI dan Coding Mulai Siswa SD Kelas 4-6, Bukan Wajib",EDUKASI
Bahlil Sebut KIM Plus Belum Keluarkan Semua Jurus untuk Menangkan Ridwan Kamil-Suswono,NEWS
"Diskon Tiket Kereta di KAI Expo 2024 Jakarta, Ini Daftar KA dan Rutenya",MONEY
"Perkosa Anak di Bawah Umur, Petani di Ende Ditangkap",REGIONAL
Buah Kedondong Bisa Mencegah Penyakit Apa? Berikut 5 Daftarnya,TREN
"BUMN Karya Dipangkas Jadi 3 Induk, HK Siap Integrasi dengan Waskita",PROPERTI
"Tak Hanya Sekali, Ibu di Batam Kerap Aniaya Anaknya, Sudah Diingatkan Warga dan Buat Surat Perjanjian",REGIONAL
Megawati Sadar Ahok Akan Dibantai kalau Maju pada Pilkada Jakarta,NEWS
"Jangan Salah, Honda Jazz Bekas Punya 2 Jenis Transmisi Matik",OTOMOTIF
3 Tips Minum Teh untuk Diet Lebih Efektif,LIFESTYLE
"Persiapan Pilkada Capai 98 Persen, KPU Salatiga Antisipasi Faktor Cuaca",REGIONAL
Harga Emas di Pegadaian Terbaru Hari Ini 16 November 2024,MONEY
Pemotor di Lenteng Agung Lempar Batu ke Transjakarta karena Merasa Dipepet,NEWS
"Pramono-Rano Bertemu Anies, Bahlil: Tak Luar Biasa",NEWS
"Hindari Pengendara Motor Diduga Mabuk dan Jatuh di Tengah Jalan, Bus Sumber Selamat Terbalik di Magetan",REGIONAL
Bagaimana Cara Cek Nomor Rekening BCA secara Online?,MONEY
"Pameran Memori Antik Tokoh Proklamasi, Menyusuri Jejak Personal Para Pejuang Kemerdekaan",TRAVEL
Jetour Siapkan Mobil Offroad T2 pada 2025,OTOMOTIF
Calvin Verdonk Akui Kualitas Jepang di Atas Timnas Indonesia,BOLA
Mengapa Tukang Pijat Ikut Bersendawa Saat Memijat Orang Lain? Ini Penjelasan Medisnya,TREN
"Satu Tahun Setelah KCJB Beroperasi, Harga Rumah di Bandung Barat Naik",PROPERTI
Polisi Sebut Ada Permen Lolipop di TKP Pembunuhan dan Pemerkosaan Anak 7 Tahun di Banyuwangi,REGIONAL
Prakiraan Cuaca Solo Hari Ini 16 November 2024 dan Besok : Sore Ini Hujan Ringan,REGIONAL
"Dalam Kondisi Terlilit Rantai, Bocah Perempuan di Batam Datangi Tetangga dan Mengaku Dianiaya Sang Ibu",REGIONAL
Gibran Harap Timnas Indonesia Tetap Semangat Usai Kalah dari Jepang,NEWS
Prakiraan Cuaca Yogyakarta Hari Ini 16 November 2024 dan Besok : Siang Ini Hujan Ringan,REGIONAL
Prakiraan Cuaca Semarang Hari Ini 16 November 2024 dan Besok: Siang Ini Hujan Ringan,REGIONAL
"Diskon Tiket Kereta di KAI Expo 2024 Jakarta, Dijual mulai Rp 79.000",MONEY
"""Battleground"" Pilkada Jakarta dan Jawa Tengah",NEWS
Blak-blakan Sri Mulyani di Balik Keputusan PPN 12 Persen,MONEY
Ahok Ungkap Sempat Ditunjuk Megawati untuk Maju Pilkada Jakarta 2024,NEWS
"Donald Trump Tunjuk Karoline Leavitt Jadi Sekretaris Pers Gedung Putih, Baru Berusia 27 Tahun",GLOBAL
"Jelang Final, Jorge Martin Sebut Sirkuit Catalunya Mesti Aspal Ulang",OTOMOTIF
"Pramono Anung: Taman Harus Terbuka 24 Jam, Orang Jakarta Butuh Tempat ""Hangout""",NEWS
[POPULER PROPERTI] Tol Tebing Tinggi-Sinaksak-Dolok Merawan Resmi Bertarif,PROPERTI
Seberapa Sering Harus Mengepel Lantai agar Bersih dan Kinclong?,HOMEY
Tips Memilih Garam Paling Sehat untuk Masakan,FOOD
"Lisa BLACPINK Kepedasan Usai Cicipi Rendang, Tanya Nasi Panas",HYPE
"Bicara di KTT APEC, Prabowo Tekankan Perdamaian dan Ajak Investasi ke RI",NEWS
Kata Rafael Struick soal Sosok Ole Romeny,BOLA
"Omzet hingga Rp 10 Juta Sehari, Berikut Kisah Hanik, Penjual Durian Asal Semarang",REGIONAL
Hyundai Bicara Strategi Menghadapi Dominasi Merek Jepang di Indonesia,OTOMOTIF
Lisa BLACKPINK Puji Energi Lilies Jakarta yang Hadir di Fan Meetup,HYPE
"KAI Beri Diskon Harga Tiket Kereta hingga 70 Persen, Simak Daftarnya",MONEY
Penutupan Mendadak Superstar Fitness Berujung Gugatan Hukum,NEWS
"8 Tips Diet Sehat dari Ahli Gizi, Wajib Hindari Gorengan",LIFESTYLE
"Wukirsari di Bantul, Satu Desa Wisata Terbaik di Dunia",TRAVEL
"WhatsApp Ubah Cara Kirim Banyak Foto Sekaligus, Jadi Lebih Simpel",TEKNO
Truk Listrik Lebih Minim Servis ketimbang Truk Konvensional,OTOMOTIF
"Usai Bertemu Anies, Pramono Yakin Didukung ""Anak Abah""",NEWS
Mengapa Eliano Reijnders Tak Diberi Kesempatan di Timnas Indonesia?,BOLA
"Hasil Survei Litbang Kompas Pilkada Sumsel 2024: Herman-Cik Ujang 48,9 Persen, Mawardi-Anita 21,6 Persen, Eddy-Riezky 8,1 Persen",TREN
Mengenal Manfaat Buah Nanas untuk Kolesterol dan Kesehatan Tubuh,HEALTH
"Jadi Dirut Baru, Ini 3 Strategi Wamildan Perbaiki Keuangan Garuda Indonesia",MONEY
Pemda Valencia Akui Kesalahan dalam Tangani Banjir Spanyol yang Mematikan,GLOBAL
"Bantah Kabar Kenaikan Gaji Guru Rp 2 Juta, Wamen Pendidikan: Kenaikan Akan Berdasarkan Sertifikasi",REGIONAL
Antonov-225 Mriya: Pesawat Terbesar Sepanjang Sejarah,TREN
7 Jenis Pakis yang Bisa Tumbuh Subur di Dalam Ruangan,HOMEY
"Hasil Practice MotoGP Barcelona 2024, Bagnaia Tercepat, Martin Kelima",OTOMOTIF
Sensasi Menikmati Kopi di Roemah Koffie pada Acara SIAL Interfood 2024,FOOD
Cara Mengecek Status BPJS Kesehatan Masih Aktif atau Tidak via Ponsel,TREN
"Hasil UEFA Nations League: 5 Spot Perempat Final Terisi, Portugal dan Spanyol Terbaru",BOLA
"12 Wanita Dikurung di Rumah Kosong di Surabaya, Dijanjikan Jadi Pemandu Lagu Karaoke",REGIONAL
Kapan Waktu Tepat untuk Ganti Filter Udara Mobil?,OTOMOTIF
"Kasus Pembunuhan dan Pemerkosaan Anak di Banyuwangi, Polisi Periksa 10 Saksi dan Amankan Barang bukti",REGIONAL
[POPULER MONEY] Sri Mulyani Sebut PPN 12 Persen Sesuai UU { Bos Lion Air Jadi Dirut Baru Garuda Indonesia,MONEY
"Dipasang di Trotoar, Alat Peraga Kampanye Paslon Pilkada Jakarta Halangi Akses Pejalan Kaki",NEWS
"Update Klasemen Grup C Usai Indonesia Digilas Jepang 0-4, Garuda Posisi Juru Kunci",TREN
"Prakiraan Cuaca Tulungagung Hari Ini Sabtu 16 November 2024, dan Besok : Sore Ini Hujan Ringan",REGIONAL
"Ivan Sugianto: Dari Intimidasi, Pamer Beking, hingga Temuan PPATK",NEWS
Jangan Keliru! Peran Ayah dalam Keluarga Tak Sekadar Pencari Nafkah,LIFESTYLE
Shin Tae-yong: Ini Bukannya Waktu Menyerah,BOLA
"NGO: Bantuan ke Gaza Hadapi Titik Terendah, Israel Juga Sengaja Serang Polisi agar Terjadi Penjarahan",GLOBAL
Wisatawan Labuan Bajo yang Tertahan akibat Erupsi Lewotobi Bisa Dapatkan Diskon Hotel hingga 50 Persen,TRAVEL
"Prakiraan Cuaca Morowali Hari Ini Sabtu 16 November 2024, dan Besok : Sore Ini Hujan Ringan",REGIONAL
"4 Makanan dengan Antibiotik Alami, Bantu Atasi Batuk dan Pilek",FOOD
Kencan Singkat dengan Jetour X70 Plus,OTOMOTIF
Tips Memilih Bantal yang Tepat untuk Tidur yang Lebih Nyenyak,HOMEY
Bunga Lawang Bisa Meredakan Penyakit Apa? Ini 5 Daftarnya,TREN
"Prakiraan Cuaca Batam Hari Ini Sabtu 16 November 2024, dan Besok : Pagi Ini Hujan Sedang",REGIONAL
"Ini Dia, Jadwal Rilis Global dan Daftar HP Xiaomi yang Kebagian HyperOS 2",TEKNO
"Bertemu Prabowo, PM Trudeau Ungkap Banyak Pengusaha Kanada Antusias Kolaborasi dengan RI",NEWS
"Prakiraan Cuaca Malang Hari Ini Sabtu 16 November 2024, dan Besok : Sore ini Hujan Ringan",REGIONAL
Presiden Prabowo dan PM Trudeau Sepakati Kerja Sama Strategis Indonesia-Kanada,NEWS
"Jadwal MotoGP Barcelona 2024, Sprint Race Digelar Malam Ini",OTOMOTIF
"Hasil Portugal Vs Polandia 5-1, Ronaldo Bersinar",BOLA
"Prakiraan Cuaca Medan Hari Ini Sabtu 16 November 2024, dan Besok : Sore ini Hujan Ringan",REGIONAL
"Lokasi SIM Keliling di Jakarta Hari Ini, Sabtu 16 November 2024",OTOMOTIF
Survei Litbang Kompas Pilgub Sumsel 2024 Ungkap Karakter Pemilih yang Lebih Subyektif,REGIONAL
Apa Itu PPN yang Bakal Naik Jadi 12 Persen Mulai 1 Januari 2025?,TREN
"Hasil Denmark Vs Spanyol 1-2: Juara Grup, La Furia Roja ke Perempat Final",BOLA
Anies dan Pramono-Rano Tertawa Bersama di Lebak Bulus…,NEWS
"Prakiraan Cuaca Bogor Hari Ini Sabtu 16 November 2024, dan Besok : Siang ini Hujan Ringan",REGIONAL
"Video Detik-detik Ban Truk Meledak, Kelebihan Beban Jadi Penyebab",OTOMOTIF
Apakah Aman Laptop Terus-menerus Berada di Mode Sleep?,TEKNO
Lokasi SIM Keliling di Jakarta Hari Ini 16 November 2024,NEWS
"Prakiraan Cuaca Surabaya Hari Ini Sabtu 16 November 2024, dan Besok : Pagi ini Cerah",REGIONAL
"Survei Litbang Kompas Pilgub Sumsel 2024, Figur Masih Lebih Menarik bagi Pemilih ketimbang Visi dan Misi",REGIONAL
"Jadi Bos Baru Garuda Indonesia, Wamildan Prioritaskan Penurunan Harga Tiket Pesawat",MONEY
Ahok Bongkar Kisah di Balik Anies Batal Diusung PDI-P pada Pilkada Jakarta,NEWS
"Prakiraan Cuaca Denpasar Hari Ini Sabtu 16 November 2024, dan Besok : Siang ini Hujan Ringan",REGIONAL
Zelensky: Perang Lawan Rusia Pasti Akan Berakhir Lebih Cepat Setelah Trump Menjabat,GLOBAL
"BERITA FOTO : Indonesia Vs Jepang, Bagaimana Samurai Biru Hancurkan Garuda",BOLA
[POPULER OTOMOTIF] Akibatnya jika Terbiasa Memutar Setir Mobil sampai Mentok | Tanda-tanda Sabuk Baja CVT Perlu Diganti | Cara China Menjaga Kualitas Sopir Truk,OTOMOTIF
Berebut Pengaruh Jokowi dan Anies pada Pilkada Jakarta,NEWS
"Perpanjang SIM Online Masih Proses, Apakah Bisa Kena Tilang Polisi?",TREN
"Survei Litbang Kompas Pilgub Sumsel 2024, Bagaimana Pengaruh Alex Noerdin?",REGIONAL
Apa yang Dirasakan Ketika Gula Darah Tinggi? Berikut 9 Gejalanya…,HEALTH
"Menilik Rumah Pelita, ""Daycare"" Khusus untuk Tangani ""Stunting"" di Kota Semarang",REGIONAL
Survei Litbang Kompas Pilgub Sumsel 2024: Paslon Diminta Benahi Persoalan Infrastruktur dan Kestabilan Harga Sembako,REGIONAL
"Survei Litbang Kompas Pilgub Sumsel 2024: Prabowo Pengaruhi Pilihan di Sumsel, Kenapa Gerinda Tidak Solid Dukung Mawardi-Anita?",REGIONAL
[POPULER TREN] 1.500 WN Korsel Dukung Timnas Indonesia Lawan Jepang | Ancaman Bom di Unpar,TREN
[POPULER GLOBAL] Mike Tyson Tampar Jake Paul | AS Desak Iran soal Nuklir,GLOBAL
"Daftar Kantor Cabang BCA Buka Layanan ""Weekend Banking"" Hari Sabtu Minggu",MONEY
Jubir Pramono-Rano Sebut Pertemuan dengan Anies Perkuat Peluang Menang Satu Putaran,NEWS
"Pelatih Jepang Sepakat dengan STY, Gol Pertama Laga Krusial",BOLA
"Survei Litbang Kompas Pilgub Sumsel 2024, Herman Deru Acak-acak Suara Partai Pesaing",REGIONAL
Rafael Struick Evaluasi Laga Kontra Jepang dan Kehadiran Ole Romeny,BOLA
Pengamat Tanah Air: Ada Harapan dari Gaya Bermain Indonesia Lawan Jepang,BOLA
"Cara Menggunakan Rumus LEFT, RIGHT, dan MID di Microsoft Excel",TEKNO
"Survei Litbang Kompas Pilgub Sumsel: Suara Gerindra dan Golkar Terpecah, Mayoritas Pilih Herman Deru, Mengapa?",REGIONAL
Survei Litbang Kompas Pilgub Sumsel: Mengapa Pemilih PDI-P Justru Beralih ke Herman Deru?,REGIONAL
Survei Litbang Kompas Pilgub Sumsel 2024: 63 Persen Gen Z Dukung Herman Deru-Cik Ujang,REGIONAL
"Survei Litbang Kompas Pilgub Sumsel: Elektabilitas Herman Deru 48,9 Persen berkat Partai Pesaing",REGIONAL
Tekad Jay Idzes Usai Kekalahan dan Kesalahan Kontra Timnas Jepang,BOLA
"Dukung Pemberantasan Aktivitas Ilegal, BRI Blokir 3.003 Rekening Judi Online",MONEY
Secercah Harap di Tengah PHK Massal...,REGIONAL
“Pegangan” Generasi Sandwich yang Terimpit,JEO
"KAI Beri Diskon Tiket Kereta Api hingga 70 Persen, Catat Tanggal dan Rutenya",MONEY
Pemotor yang Lemparkan Batu ke Kaca Depan Bus Transjakarta di Lenteng Agung Ditangkap Polisi,NEWS
Kendala Teknis Alasan KPU Tiba-tiba Batalkan Debat Kedua Pilwalkot Batam,REGIONAL
Hajime Moriyasu Bicara soal Suporter Indonesia dan Kans Timnas Lolos ke Piala Dunia,BOLA
Owner 101 Coffee House and Roastery Ungkap Manfaat Menggunakan KUR bagi UMKM,UMKM
AHY Harap Harga Tiket Pesawat Turun Sebelum Desember 2024,MONEY
Mengenal Tiga Pilar Multi Bintang Indonesia Guna Dorong Bisnis Berkelanjutan,MONEY
"STY Jaga Keyakinan Timnas Indonesia, Masih Ada Harapan Usai Dibekuk Jepang",BOLA
"Indonesia Vs Jepang, STY Sesalkan Ragnar Gagal Cetak Gol",BOLA
"Indonesia Kalah 0-4 dari Jepang, Pendukung Kecewa tapi Tak Hilang Harapan",REGIONAL
Cara Tarik Saldo LinkAja di ATM BCA,MONEY
"Di Hadapan Polisi, Ayah Bocah Korban Pembunuhan di Banyuwangi Minta Dipertemukan dengan Pelaku",REGIONAL
"Saat PHK di Jateng Paling Tinggi, 12.489 Pekerja Dirumahkan...",REGIONAL
"Kasus Pembunuhan Bocah di Banyuwangi, Tetangga Kaget Ibu Korban yang Hamil Tua Gendong Jasad Anaknya",REGIONAL
Nenek Ini Tetap Optimistis Usai Kekalahan Indonesia Lawan Jepang,NEWS
"Gelar Rakernas, Menag Minta Jajarannya Berikan Solusi Terbaik untuk Umat",NEWS
"Debat Pilkada Bantul dan Polemik soal Korupsi, Kolusi, dan Nepotisme",REGIONAL
Sopir Truk Jadi Tersangka Kecelakaan Beruntun di Tol Cipularang,REGIONAL
"Stasiun Cisauk Sempat Gangguan Sinyal, Kini Perjalanan KRL Mulai Normal",NEWS
Rekaman CCTV Terbaru Menunjukkan Liam Payne Bersama Tersangka Beberapa Jam Sebelum Kematiannya,HYPE
"Memutus Rantai Generasi Sandwich, BPJS Ketenagakerjaan Bisa Jadi Solusi",MONEY
"ATM Bank Pelat Merah di Baubau Terbakar, Nasabah Panik Saat Bertransaksi, Apa Penyebabnya?",REGIONAL
KPK Tetapkan Pejabat BPK Tersangka Kasus Suap Proyek Jalur Kereta Api,NEWS
Erick Thohir Minta Maaf Usai Kekalahan Timnas Indonesia,BOLA
Elnusa Petrofin Apresiasi 88 Awak Mobil Tangki BBM dengan Perjalanan Ibadah,MONEY
Kepala Sekolah di Banyuwangi Syok Siswinya Dibunuh dan Diperkosa Sepulang Sekolah,REGIONAL
Cara Membuat Saus Ekstra Pedas ala Rumahan,FOOD
Polisi Ungkap Alasan Tersangka Bungkus Jasad dengan Kasur di Cikupa,NEWS
Sydney Sweeney Mengkritik Standar Ganda Hollywood Setelah Dapat Komentar Kasar dari Produser Kawakan,HYPE
"Wamen Pendidikan Janji Kurangi Beban Administratif Guru, Apa Alasannya?",REGIONAL
"Klasemen Grup C Kualifikasi Piala Dunia 2026, Timnas Indonesia Masih di Bawah",BOLA
"Elektabilitas Luluk-Lukman 3,8 Persen Versi Survei Litbang Kompas, Ini Respons Ketua Timses",REGIONAL
"Kisah Alumni Institut Kemandirian Dompet Dhuafa, Dirumahkan Saat Pandemi, Kini Buka Kedai Kopi",NEWS
BNI Sumbang Rp 77 Triliun ke Penerimaan Negara dalam 5 Tahun,MONEY
"Kehujanan di GBK, Keluarga Ini Tetap Setia Dukung Kiper Maarten Paes",NEWS
"Lisa BLACKPINK Sapa Lilies di Fan Meetup Jakarta dengan ""Lalisa""",HYPE
Rahasia Mick Jagger Tetap Energik Layaknya ABG meski Usia 81 Tahun,HYPE
Rizky Ridho: Timnas Indonesia Tidak Seharusnya Kalah 0-4 dari Jepang,BOLA
Bagaimana Cara Beli Tiket Kereta Go Show?,MONEY
7 Jenis Bantal Terbaik untuk Tidur Berdasarkan Isian dan Fungsinya,HOMEY
Dishub Siapkan Rekayasa Lalu Lintas untuk Debat Ketiga Pilkada Jakarta 2024,NEWS
"Lewat Sepak Bola Lintas Komunitas, Dompet Dhuafa Berhasil Kumpulkan Donasi untuk Warga Palestina",NEWS
Program dan Janji-janji Agustina-Iswar di Debat Pilkada Kota Semarang 2024,REGIONAL
"Wujudkan Komitmen ESG untuk Lingkungan Berkelanjutan, Telkomsel Tanam 10.600 Mangrove",ADVERTORIAL
"Kunjungi Ponpes, Risma Paparkan Program Pendidikan Gratis Setara SMA/SMK di Jatim",REGIONAL
"UMP Jateng Diumumkan 20 November, Pj Nana Minta Buruh dan Pengusaha Tidak Berselisih",REGIONAL
"Prabowo: Kami Dorong Lebih Banyak Eksplorasi Minyak dan Gas, Indonesia Terbuka untuk Bisnis",MONEY
"Berkat Lahan Wakaf Dompet Dhuafa, Petani Baby Buncis di Sukabumi Gelar Panen Perdana",NEWS
"Jenazah Wanita Terbungkus Kasur di Cikupa, Polisi: Tersangka Dihina Bau Badan",NEWS
"Derita Korban Candu Judi ""Online"" di Cirebon, Putus Kuliah hingga Gadai Kendaraan",REGIONAL
Guru SMP di Kepulauan Aru Maluku Ditangkap Usai Cabuli Siswi,REGIONAL
"Intip Outfit Gibran Rakabuming dan Jan Ethes, Nonton Timnas di GBK",LIFESTYLE
"Jokowi Ikut Nobar Indonesia Vs Jepang di Alun-alun Purwokerto, Sempat Borong Es Teh",REGIONAL
Apa Itu PPN? Ini Penjelasannya,MONEY
2 Petugas KPPS Jakarta Timur Diberhentikan karena Tidak Netral dalam Pilkada,NEWS
Sejuta Pohon Akan Ditanam di Lahan Kritis Wilayah Bangka Belitung,LESTARI
"Mengenal Didong, Kesenian dari Gayo: Pengertian, Sejarah, dan Tujuan",REGIONAL
Menteri Komdigi Diminta Transparan soal Aplikasi Ilegal,REGIONAL
UFILM Kenalkan Kaca Film Mobil dengan Teknologi CoreNano,OTOMOTIF
"Debat Pilkada Kota Semarang, Yoyok-Joko Akan Jadikan Rumah Ibadah sebagai Cagar Budaya",REGIONAL
"Jihad Islam Palestina Rilis Video Baru Sandera Israel di Gaza, Ini yang Diminta",GLOBAL
Kapitalisasi Pasar Bitcoin Kini Kalahkan Perak,MONEY
"Ole Romeny Nonton Timnas Indonesia vs Jepang di GBK, Intip Tampilannya",LIFESTYLE
Perempuan Ini Laporkan Mantan Suami ke Polisi Terkait Tuduhan Fitnah Saat Sidang Perceraian,NEWS
Resep Sandwich Chicken untuk Bekal Piknik,FOOD
PT DBS Vickers Sekuritas Indonesia Tanam 100 Pohon Trembesi di Waduk Brigif,LESTARI
"Filosofi Angka 11, 21, 25, 50, dan 60 dalam Budaya Jawa yang Jarang Orang Tahu, Apa Itu?",TREN
"Beda dengan Kebiri, Vasektomi Masih Bisa Ereksi dan Ejakulasi Normal",HEALTH
"Dukung Program Ketahanan Pangan, Polresta Sleman Menebar 4.000 Bibit Ikan",REGIONAL
"Pramono-Rano Temui Anies Baswedan, Tak Ada Bahas soal Kampanye Akbar",NEWS
Hasil Indonesia Vs Jepang 0-4: Garuda Belajar dari Nomor 1 Asia,BOLA
Cara Daftar Shopee Paylater secara Online,MONEY
Ridwan Kamil Janji Survei Ulang Data Kependudukan agar Bansos Pemerintah Tepat Sasaran,NEWS
TDA Luxury Toys Resmi Bawa MV Agusta ke Indonesia,OTOMOTIF
5 Tips Memilih Warna Lantai yang Tepat untuk Rumah,HOMEY
Cerita Petugas Pemilu di Kuningan Baru Terdaftar BPJS Ketenagakerjaan sejak Reformasi,REGIONAL
WMO:  Layanan Iklim Penting bagi Keberlanjutan Global,LESTARI
Politikus Golkar Laporkan Seorang Pengacara ke Polisi Terkait Hoaks Pembatalan Hasil Munas,NEWS
"Kejar Swasembada Pangan, Kementan dan Kementerian PU Akan Normalisasi Irigasi untuk  Optimasi Lahan 1 Juta Hektar",MONEY
"Kronologi ""Driver"" Ojol Dibegal Penumpang di Bandung Barat",TREN
"Live Indonesia Vs Jepang: Gol Ke-4 Samurai Biru, Kans Arhan Digagalkan",BOLA
"Ada 16 TPS di Palangka Raya yang Rawan Terdampak Banjir, Ini Lokasinya",REGIONAL
"Syarat Indonesia Maju 2045, Ridwan Kamil: Generasi Mudanya Tak Hobi Terima Bansos",NEWS
Cabup Sumedang Dony Ahmad Munir Janjikan Rumah Kemasan untuk UMKM,REGIONAL
"15 Kades di Magelang Deklarasikan Dukungan ke Grengseng-Sahid, Bawaslu Nyatakan Tidak Langgar Pidana Pilkada",REGIONAL
"Korsleting, Gerai Kecantikan di dalam Galaxy Mall Surabaya Terbakar",REGIONAL
"Dukung Hilirisasi serta Swasembada Pangan dan Energi, Kementerian BUMN-Kementerian PU Perkuat Sinergi",ADVERTORIAL
"Resep Tumis Tempe Udang Buncis, Lauk Praktis untuk Akhir Pekan",FOOD
"7 Manfaat Daun Kenikir, Diyakini Ampuh Atasi Hipertensi dan Diabetes",TREN
Polisi Tangkap Pelempar Batu Bus Transjakarta di Lenteng Agung,NEWS
"Limbah Tulang Tuna di Ambon, Jadi Camilan Stik Ikan Berkalsium",REGIONAL
"Singgung Supian Suri, Imam Budi: Lawan Saja Kita Kasih Jabatan Sekda",NEWS
