Judul,Kelas
"Rapat dengan Wapres Gibran, Penjabat Bupati Flores Timur Heran Data Pengungsi Erupsi Lewotobi di Sikka Lebih dari 3.000",REGIONAL
"Jelang Laga Indonesia Vs Jepang, Simak Lokasi Kantong Parkir di GBK",OTOMOTIF
"Aturan Baru Bagasi Lion Group, Bawa Kardus dkk Bisa Kena Biaya Tambahan",TRAVEL
Roemah Koffie Luncurkan Mesin Kopi Kapsul di SIAL Interfood 2024,FOOD
"Motif Pria Bunuh dan Cor Wanita di Belitung Timur, Cemburu Korban Panggil Sayang ke Mantan",REGIONAL
"Indonesia Vs Jepang, Samurai Biru Punya ""Klop""",BOLA
Ayah di Banjarmasin Cabuli Anak Kandung hingga Hamil,REGIONAL
Aplikasi Pesaing X Twitter Kebanjiran Pengguna Baru Usai Donald Trump Menang Pemilu AS,TEKNO
"AS Desak Iran Buktikan Komitmen Nuklir Lewat Tindakan Nyata, Bukan Janji",GLOBAL
"CEO Nvidia Jensen Huang: AI Adalah Masa Depan, Siapkah Indonesia Beradaptasi?",MONEY
Pemerintah Siapkan Peta Jalan Reforestasi 12 Juta Hektare Hutan Rusak,LESTARI
"Prakiraan Cuaca Surabaya Hari Ini Jumat 15 November 2024, dan Besok : Pagi ini Cerah",REGIONAL
"Jadwal Indonesia Vs Jepang di Kualifikasi Piala Dunia 2026, Pukul Berapa?",TREN
7 Kegunaan Vacuum Cleaner Selain Menyedot Debu pada Lantai,HOMEY
"Bandara Tutup, 4.387 Wisatawan Terdampak Gunung Lewotobi Sudah Dievakuasi Lewat Jalur Laut",REGIONAL
"Prakiraan Cuaca Malang Hari Ini Jumat 15 November 2024, dan Besok : Tengah Malam ini Berawan",REGIONAL
Daftar Rute Transjakarta yang Jam Operasionalnya Diperpanjang Hari Ini,NEWS
"Jadi Green Port Pertama di Indonesia, Container Yard Pelabuhan Batu Ampar Tembus 20 Persen",PROPERTI
Prakiraan Cuaca Jakarta Hari Ini Jumat 15 November 2024 dan Besok: Malam Ini Hujan Ringan,NEWS
"Bertemu dan Didoakan Said Aqil, Ridwan Kamil: Beliau Guru Saya",NEWS
"Prakiraan Cuaca Medan Hari Ini Jumat 15 November 2024, dan Besok : Sore ini Hujan Ringan",REGIONAL
Bos Garuda Ungkap Alasan Harga Tiket Pesawat Domestik Lebih Mahal,MONEY
Lokasi SIM Keliling di Jakarta Hari Ini 15 November 2024,NEWS
Strategi Menekan Angka Kecelakaan di Tol Cipularang,OTOMOTIF
"4.000 Prajurit TNI Terlibat Judi “Online” Bukan karena Masalah Kesejahteraan, Lalu Apa Penyebabnya?",NEWS
Prabowo dan PM Albanese Sepakat Tingkatkan Kerja Sama Strategis Indonesia-Australia,NEWS
"Prakiraan Cuaca Bogor Hari Ini Jumat 15 November 2024, dan Besok : Siang ini Hujan Ringan",REGIONAL
3 Cara Blokir Nomor Tidak Dikenal di iPhone dengan Mudah dan Cepat,TEKNO
"Sudaryono: Survei Kita, Ahmad Luthfi-Taj Yasin Lebih Unggul",REGIONAL
"""Lapor Mas Wapres” Program Pemerintah yang Jamin Aduan Warga Ditindaklanjuti",NEWS
"Kenali Bahaya ""Doom Spending"" buat Keuangan Generasi Muda",MONEY
"Menguak Rahasia Kuah Pekat Rawon Subedo, Kuliner Khas Surabaya",REGIONAL
"PPN Tetap Naik Jadi 12 Persen mulai 1 Januari 2025, Apa Alasannya?",TREN
PBB: Perang Israel di Gaza Penuhi Kriteria Genosida,GLOBAL
"Indonesia Vs Jepang di GBK Malam Ini, Ada Rekayasa Lalu Lintas Senayan",OTOMOTIF
Viral Video Aksi Koboi Pengendara Mobil Todongkan Benda Mirip Senpi di Tol Japek,NEWS
"Hasil Venezuela Vs Brasil, Vinicius Gagal Penalti hingga Drama Sprinkler Warnai Hasil Imbang",BOLA
Memastikan Pemberantasan Korupsi Melalui Pemilihan Kepala Daerah,NEWS
"Prakiraan Cuaca Tulungagung Hari Ini Jumat 15 November 2024, dan Besok : Tengah Malam Ini Hujan Ringan",REGIONAL
"Ditunjuk Jadi Plh Gubenur Kalsel, Roy: Pemerintahan Harus Tetap Berjalan",REGIONAL
"Prakiraan Cuaca Batam Hari Ini Jumat 15 November 2024, dan Besok : Tengah Malam Ini Hujan Ringan",REGIONAL
Kapan Waktu Ideal Ganti Busi Mobil yang Benar?,OTOMOTIF
"Prakiraan Cuaca Balikpapan Hari Ini Jumat 15 November 2024, dan Besok : Pagi Ini Hujan Ringan",REGIONAL
Tak Ada Lagi Habis Manis Sepah Dibuang di Sepak Bola Indonesia,BOLA
"Prakiraan Cuaca Morowali Hari Ini Jumat 15 November 2024, dan Besok : Tengah Malam Ini Berawan",REGIONAL
Kisah Pemandian Air Panas Bangka Tengah yang Diyakini Bisa Sembuhkan Penyakit,TRAVEL
[POPULER OTOMOTIF] Truk yang Sebabkan Kecelakaan di Tol Cipularang Over Dimension | Sopir Truk Sering Lakukan Teknik Ini agar Irit BBM | Lelang Murah Kia Carens dan Fiat Punto,OTOMOTIF
"Akankah Budi Arie Diperiksa di Kasus Judi ""Online"" Usai Istana Beri Lampu Hijau?",NEWS
"3 Efek Samping Makan Labu Kuning, Termasuk Kembung dan Alergi",HEALTH
BMKG Ungkap Wilayah yang Berpotensi Hujan pada 15-16 November 2024,TREN
Emiten Manufaktur Otomotif DRMA Cetak Laba Bersih Rp 412 Miliar Per Kuartal III 2024,MONEY
"Indonesia Vs Jepang, Hitung-hitungan jika Timnas Menang",BOLA
Mendes Yandri: Serang Potensial Suplai Bahan Baku Makan Bergizi,REGIONAL
Upaya Genjot Elektabilitas pada Pilkada Jatim dalam 2 Pekan Tersisa,REGIONAL
Trump Tunjuk Robert F Kennedy Jr Pimpin Departemen Kesehatan dan Layanan Kemanusiaan (HHS),GLOBAL
"Sauna Rusak dan Alat Gym Tak Premium, Member Superstar Fitness Curiga Ada Penipuan Sistematis",NEWS
"Kasus Judi ""Online"", Kementerian Komdigi Pecat 10 Pegawai dan Maaf dari Menteri",NEWS
Survei Litbang Kompas Pilkada Jatim 2024: Pengangguran Jadi Masalah Terpenting,REGIONAL
Simak Rekayasa Lalu Lintas di Sekitar GBK Saat Laga Timnas Indonesia Vs Jepang,NEWS
Mengapa Anggota DPR Kompak Mencecar Jaksa Agung Terkait Kasus Tom Lembong?,NEWS
Wapres Gibran Kunjungi Bayi Pengungsi Erupsi Lewotobi yang Diberi Nama Gibran,REGIONAL
"Kawasan Pinggir Sungai di Palangka Raya Rawan Banjir, KPU Kota Siapkan TPS Alternatif",REGIONAL
"Hasil UEFA Nations League: Tonali Bawa Italia Menang, Inggris Bekuk Yunani",BOLA
"Korban Dugaan Penipuan Superstar Fitness Mencapai 750 Orang, Kerugian Rp 5,1 Miliar",NEWS
Survei Litbang Kompas Pilkada Jatim: Khofifah-Emil Diuntungkan sebagai Petahana,REGIONAL
"[POPULER TREN] Bus ""Pulang Malu Tak Pulang Rindu"" Mengaspal di Jepang | Prof Ichlasul Amal Meninggal",TREN
"Di Balik Kebijakan Impor Susu, Antara Komitmen Internasional atau Nasib Peternak Indonesia",MONEY
Pengaspalan Landasan Pacu Bandara Internasional Nusantara Tuntas 2024,IKN
Nusron Sebut Mafia Tanah di Dago Elos Bakal Dimiskinkan,PROPERTI
[POPULER GLOBAL] Mike Tyson Vs Jake Paul | Rudal Hizbullah Serang Markas Besar Tentara Israel,GLOBAL
"Diduga Masalah Warisan, Pria di Surabaya Bacok Kakak dan Ponakan hingga Tewas",REGIONAL
"Wanita Ini Bayar Rp 31 Juta Jadi Member Seumur Hidup, Tiba-tiba Superstar Fitness Tutup",NEWS
"Kapolri Sebut Jumlah KKB Meningkat, Ini Penyebabnya",NEWS
Prediksi Line-up Paraguay Vs Argentina: Messi Siap Menggempur,BOLA
"Australia Vs Arab Saudi 0-0, Socceroos Naik ke Peringkat Kedua",BOLA
Pelaku yang Suruh Siswa SMA Menggonggong di Surabaya Terancam 3 Tahun Penjara,REGIONAL
[POPULER NASIONAL] Dankorbrimob Bantah Jaksa Agung soal Pengepungan | Jaksa Agung Dicecar soal Kasus Tom Lembong,NEWS
"Karma Bahrain Vs China: Diving, Gol Dianulir, dan Kartu Merah di Kualifikasi Piala Dunia",BOLA
"Mancing Gurita di Sekitar Pantai Watu Lumbung, Nelayan di Gunungkidul Ditemukan Tewas Tenggelam",REGIONAL
[POPULER JABODETABEK] Lansia dari Surabaya ke Istana Wapres Minta Utangnya Dihapus | Kebun Ganja Milik Pria di Cengkareng Ada di Atas Genteng,NEWS
"Apakah ""Endorsement"" Tokoh Politik ke Paslon Pilgub Jatim Pengaruhi Keputusan Pemilih?",REGIONAL
NI dan MPTC Sepakat Berkolaborasi Bangun 10.000 Km Jalan Tol,PROPERTI
"[POPULER MONEY] Tarif PPN Pasti Naik Jadi 12 Persen Tahun Depan | Prabowo ""Video Call"" dengan CEO Nvidia",MONEY
Badan Lemas Terus Harus Minum Vitamin Apa? Berikut 6 Daftarnya…,HEALTH
"Supermoon Terakhir 2024 Hari Ini, Catat Waktu Puncak dan Cara Melihatnya",TREN
"Lewat Lukisan, Darsono Sang Veteran Asal Bogor Kenang Perjuangannya untuk Kemerdekaan RI",NEWS
Bolehkah Membawa Kendaraan Pribadi ke dalam TMII?,NEWS
Momen Presiden Prabowo Santap Pagi Bersama PM Albanese di Peru,NEWS
"Bertemu PM Albanese di Peru, Prabowo Sebut Australia ""Very Good Friend of Indonesia""",NEWS
"Hasil Yunani Vs Inggris 0-3, Gol Debut Curtis Jones Bawa The Three Lions Menang",BOLA
"Hasil Belgia Vs Italia 0-1: Tonali Cetak Gol Perdana, Italia Menang",BOLA
Survei Litbang Kompas Pilkada Jatim 2024: Khofifah-Emil Unggul di Semua Generasi,REGIONAL
Ambulans Angkut Jenazah Ringsek Bertabrakan dengan Truk Tangki di Jepara,REGIONAL
"Survei Litbang Kompas Pilgub Jatim: Pemilih PDI-P Terbelah, Khofifah-Emil ""Curi"" Dukungan",REGIONAL
"Survei Litbang Kompas Pilkada Jatim 2024: Elektabilitas Luluk Tertinggal, gara-gara Mesin Partai Mandek?",REGIONAL
"Sidang Etik DKPP, Saksi PPK di Brebes Sebut Terima Suap Uang Puluhan Juta di Kresek Hitam",REGIONAL
Tanggal 17 November 2024 Memperingati Hari Apa?,NEWS
"Hasil Survei Litbang Kompas Pilgub Jatim, Pemilih Perempuan Cenderung Pilih Khofifah-Emil",REGIONAL
"Survei Litbang Kompas Pilkada Jatim 2024: 55,3 Persen Warga NU Dukung Khofifah-Emil",REGIONAL
Survei Litbang Kompas Pilgub Jatim: Khofifah-Emil Unggul di Semua Wilayah Sosiokultur,REGIONAL
"Hasil Survei Litbang Kompas Pilgub Jatim 2024: Popularitas Khofifah-Emil Unggul, Apa Penyebabnya?",REGIONAL
Jenis-jenis Cloud Computing dalam Menyediakan Layanan Komputasi,TEKNO
Survei Litbang Kompas Pilgub Jatim: Ini Penyebab Elektabilitas Khofifah-Emil Unggul,REGIONAL
"Survei Litbang Kompas Pilkada Jatim 2024: Elektabilitas Khofifah-Emil 52,5 Persen",REGIONAL
Perkembangan Sepak Bola Indonesia dalam Pandangan Takumi Minamino,BOLA
"UPDATE Klasemen Grup C: China Menang Atas Bahrain, Indonesia Juru Kunci",BOLA
Tanggal 16 November 2024 Memperingati Hari Apa?,NEWS
Kemenperin Pantau Langsung Sritex yang Tengah Kekurangan Bahan Baku,MONEY
"Konsumen Bisa Cek Keaslian Bright Gas dengan Scan Barcode, Begini Caranya",MONEY
"Misteri Arca Unfinished Buddha Candi Borobudur, Benarkah Ini Berasal dari Dalam Stupa Induk?",REGIONAL
Daftar Emiten yang Bagi-Bagi Dividen Interim Jelang Akhir 2024,MONEY
"Hasil Bahrain Vs China 0-1: Drama Menit Akhir, Tuan Rumah Tumbang",BOLA
"CEO Indosat: Di Indonesia, Jumlah Akun Tiktok Lebih Banyak dari Rekening Bank",MONEY
"Rano Karno Bertemu Komunitas Ojol di Jakut, Warga: Ganteng Banget!",NEWS
PLN Gandeng Sembcorp-TGI Garap Proyek Hidrogen Hijau Terbesar di ASEAN,MONEY
"Erick Thohir Dobel Salaman, Dion Markx dan Tim Geypens Siap Bela Merah Putih",BOLA
"Erick Thohir Rombak Jajaran Komisaris PLN, Ini Susunannya",MONEY
Fahira Idris: Ridwan Kamil Bakal Tutup Pabik Miras PT Delta Djakarta jika Menang Pilkada,NEWS
6 Manfaat Kesehatan dari Konsumsi Oat dan Oatmeal,FOOD
Serial Wednesday Tambahkan Lady Gaga sebagai Pemeran untuk Season 2,HYPE
"Peduli Kesehatan Mental, Bluebird Hadirkan ""Well-Nest Ride""",MONEY
"Ada Pencurian Kabel, CCTV Pompa Air ""Underpass"" Kebayoran Lama Ternyata Tak Berfungsi",NEWS
"Menyeruput Tahwa, Minuman Tradisional Penghangat Tubuh di Kala Senja",REGIONAL
La Grande Indonesia: Proses Penyaluran Tiket Masih Berlanjut,BOLA
"Banyak Warga Depok Sakit Ginjal, Supian-Chandra Ingin Bangun RS Khusus",NEWS
"Debat Pilkada Depok: Imam-Ririn Janji Bangun Sekolah, Supian-Chandra Ingin Dirikan Faskes",NEWS
Sopir Truk Penyebab Kecelakaan di Tol Cipularang Bantah Mengantuk,REGIONAL
"Ridwan Kamil-Suswono Tandatangani Pakta Integritas, Fahira Idris Beberkan Poin-poin Kesepakatannya",NEWS
"Tak Perlu Cemas, Petugas ""Ad Hoc"" Pilkada Jember Dilindungi BPJS Ketenagakerjaan",REGIONAL
Lirik dan Chord Lagu Sleep – My Chemical Romance,HYPE
Pentingnya Pemeriksaan Gula Darah agar Terhindar dari Diabetes,HEALTH
Jadwal Grand Opening Pakuwon Mall Bekasi dan Jam Operasionalnya,NEWS
"Klasemen Grup C: Australia Vs Arab Saudi Seri, Indonesia Peringkat Kelima",BOLA
Lirik dan Chord Lagu Mama – My Chemical Romance,HYPE
Kontes Mirip Nicholas Saputra Terinspirasi dari Acara Mirip Timothée Chalamet di New York,HYPE
Hajime Moriyasu: Timnas Jepang Siap Melawan Indonesia,BOLA
"FFI 2024 Hadirkan Kembali Piala Antemas, Penghargaan untuk Film Terlaris",HYPE
"Kabel Sempat Dicuri, Pompa Air ""Underpass"" Kebayoran Lama Kini Dicek Petugas Tiap Satu Jam",NEWS
Lirik dan Chord Lagu House of Wolves – My Chemical Romance,HYPE
"Film Lembayung Turun Layar, Lanjut Tayang di Luar Negeri",HYPE
Lirik dan Chord Lagu The Sharpest Lives – My Chemical Romance,HYPE
3 Cara Membersihkan Kepala Keran agar Bebas Kerak,HOMEY
Pemkot Surabaya Raih Penghargaan Badan Publik Informatif di KI Jatim Awards 2024,NEWS
"Superstar Fitness Mendadak Tutup, padahal CM Baru Bayar Biaya ""Member"" Seumur Hidup",NEWS
Lirik dan Chord Lagu The End – My Chemical Romance,HYPE
"Debat Pilkada Lebak, Hasbi Janji Perbaiki Infrastruktur, Dede Beri Beasiswa, Sanuji Siapkan Bus Healing",REGIONAL
Pemprov Riau Raih Peringkat 5 dalam Penghargaan Predikat Kepatuhan Penyelenggaraan Pelayanan Publik 2024,REGIONAL
Lirik dan Chord Lagu I Never Told You What I Do for a Living – My Chemical Romance,HYPE
"Hadapi Gempuran Fesyen Impor, 180 Brand Lokal Kumpul di Bandung",REGIONAL
"Resmi Ditutup, Pertamina Goes To Campus di Universitas Mulawarman Kampanyekan Isu Ketahanan Energi",NEWS
"Ma'ruf Amin: Nisob dan Nasab Luluk-Lukman Bagus, Nasibnya Belum Tahu",REGIONAL
Pengakuan Sopir Truk Penyebab Kecelakaan Tol Cipularang: Saya Sudah Injak Rem,REGIONAL
Lirik dan Chord Lagu Bulletproof Heart – My Chemical Romance,HYPE
"Bertemu Menko Hukum, HAM, dan Imipas, Menpan-RB Bahas Percepatan Pengisian Jabatan ASN",NEWS
Lirik dan Chord Lagu Sing – My Chemical Romance,HYPE
Lirik dan Chord Lagu Planetary (Go!) – My Chemical Romance,HYPE
"Percaya Diri Menang Pilkada Jakarta, Ridwan Kamil: Jokowi Jelas Dukung Saya",NEWS
"Tinjau Progres MPP HST, Pjs Bupati Faried Rencanakan Soft Launching pada Desember 2024",REGIONAL
Dua Mobil Terbakar Imbas Kecelakaan di Depan Perumahan Navapark BSD,NEWS
Lirik dan Chord Lagu Party Poison – My Chemical Romance,HYPE
Mendes PDT Minta Menteri PU Buka Bendungan Sindangheula untuk Umum,REGIONAL
"Resep Bandeng Bersarang, Gunakan Ikan Presto Siap Pakai",FOOD
Kata Jay Idzes Soal Laga Indonesia Vs Jepang di Piala Asia 2023,BOLA
Gappri Khawatir Kenaikan Harga Jual Eceran SKT Berdampak ke Industri Hasil Tembakau,MONEY
"Lirik dan Chord Lagu Save Yourself, I’ll Hold Them Back – My Chemical Romance",HYPE
PCO Sebut “Lapor Mas Wapres” Terima 296 Aduan dalam Empat Hari,NEWS
Lirik dan Chord Lagu The Kids from Yesterday – My Chemical Romance,HYPE
Survei Indikator: Anak Muda Depok Lebih Banyak Dukung Supian-Chandra di Pilkada,NEWS
Pembatalan Penerbangan di Bandara Komodo Masih Terjadi,TRAVEL
"Ada 48.000 Kasus Mafia Tanah di Indonesia, 79 Persen Sudah Beres",PROPERTI
Apa Ciri-ciri Gatal karena Diabetes? Berikut Daftarnya...,HEALTH
"NASA Sebut Bendungan Tiga Ngarai China Mengubah Rotasi Bumi, Apa Dampaknya?",TREN
Lirik dan Chord Lagu Wish You Were Here – Fleetwood Mac,HYPE
4 Pesohor Hollywood yang Jadi Penggemar Berat Kucing,HOMEY
"Ekstensi File yang Tersimpan Pada Microsoft Word 2010, 2013, dan 2016",SKOLA
"Kunjungi Korban Erupsi Gunung Lewotobi, Gibran Beri Mainan untuk Anak Pengungsi",NEWS
"5 Tempat Gym Murah Meriah di Jakarta, Harga di Bawah Rp 300.000",LIFESTYLE
Lirik dan Chord Lagu That’s All for Everyone – Fleetwood Mac,HYPE
Strategi DBS Indonesia Jaga Pertumbuhan Kredit Konsumer di Tengah Pelemahan Daya Beli Masyarakat,MONEY
"Jadi Pahlawan Inklusi Keuangan, AgenBRILink Dekatkan Layanan Perbankan di Tengah Kebun Kelapa Sawit",ADVERTORIAL
"""Fit and Proper Test"" Capim dan Dewas KPK Digelar Pekan Depan, Golkar Akan Didalami Ini",NEWS
Peran Jaminan Sosial Ketenagakerjaan untuk Menekan Jumlah Generasi Sandwich di Indonesia,TREN
Dave Mustaine Vokalis Megadeth akan Membayar Mantan Manajernya Lebih Dari Rp 22 Miliar untuk Penyelesaian Kasus Hukum,HYPE
Saat Anak-anak Penyintas Erupsi Gunung Lewotobi Dapat Mainan Lego dari Wapres Gibran,REGIONAL
Lirik dan Chord Lagu Not That Funny – Fleetwood Mac,HYPE
Mobil Listrik Terlibat Kecelakaan Beruntun di Tol BSD,NEWS
"Anaknya Disuruh Menggonggong oleh Pengusaha Surabaya, Orangtua: Hati Saya Terluka",REGIONAL
Auditor BPKP Sebut Pembayaran PT Timah ke Sejumlah CV Tidak Sesuai Dokumen,NEWS
Pria di Cikupa Bunuh Wanita yang Baru Dikenal sebab Sakit Hati Dihina Usai Hubungan Badan,NEWS
Lirik dan Chord Lagu Angel – Fleetwood Mac,HYPE
"Karang Terbesar di Dunia Ditemukan di Kepulauan Solomon, Terlihat dari Luar Angkasa",GLOBAL
"5 Tempat Gym Khusus Cewek di Jakarta Murah Meriah, Mulai Rp 60.000-an",LIFESTYLE
Bank Mandiri Mantapkan Komitmen Ekonomi Berkelanjutan pada COP 29 di Azerbaijan,MONEY
"Indonesia Vs Jepang, Shin Tae-yong Minta Garuda Main Tanpa Beban",BOLA
"Targetkan Harga Tiket Pesawat Turun, Wamenhub: Kado Natal dan Tahun Baru",MONEY
"Bocah 7 Tahun di Banyuwangi Tewas Dibunuh dan Diduga Diperkosa, Pemkab Berikan Pendampingan",REGIONAL
Lirik dan Chord Lagu That’s Enough for Me – Fleetwood Mac,HYPE
Linkin Park Konser di Jakarta 16 Februari 2025,HYPE
"Tingkatkan Literasi, Gramedia Buka Gerai Kedua di Purwokerto",REGIONAL
Ridwan Kamil Mengaku Disemangati Prabowo Lewat WhatsApp Sebelum ke Kampanye Akbar,NEWS
Lirik dan Chord Lagu Brown Eyes – Fleetwood Mac,HYPE
Bank Mandiri Taspen Luncurkan Program Usaha Toko Frozen Mantap,MONEY
Lirik dan Chord Lagu Never Make Me Cry – Fleetwood Mac,HYPE
"Dugaan Penipuan Keanggotaan di Superstar Fitness, Kerugian Korban Mencapai Rp4,6 Miliar",NEWS
"Negara Harus Menang Lawan Pontjo Sutowo, Nusron Perjuangkan Hotel Sultan",PROPERTI
"Studi Ungkap Ingatan Tak Hanya Tersimpan di Sel Otak, Lantas di Mana Saja?",TREN
"Temui Anies, Atang Trisnanto Minta Didukung di Pilkada Kota Bogor 2024",NEWS
DBS Indonesia Manfaatkan Momen Lonjakan Paylater untuk Dongkrak Kredit Konsumsi,MONEY
Polisi Sebut Siswa SMA Korban Intimidasi di Surabaya Alami Trauma,REGIONAL
"Jay Idzes Bicara ""Chemistry"" dan Proyek Jangka Panjang Timnas Indonesia",BOLA
Indonesia vs Jepang: STY Nilai Hasil Seri Australia dengan Arab Saudi Baik Bagi Garuda,BOLA
"Viral, Video Ibu-ibu di Makassar Terlibat Perkelahian hingga Saling Banting di Jalan, Ini Kata Polisi",REGIONAL
Ini Daftar Barang yang Terdampak dan Tidak Terdampak PPN 12 Persen,MONEY
Ini Dia Pemenang Kompetisi Mirip Nicholas Saputra,HYPE
"Tingkatkan Keamanan Data BUMN, Erick Thohir Gandeng Amazon Web Services",MONEY
Berapa Suhu AC yang Ideal untuk Tidur?,HOMEY
Lirik dan Chord Lagu Destroya – My Chemical Romance,HYPE
"Masih Bisa Terima ""Endorsement"" padahal Pejabat Negara, Raffi Ahmad: Enggak Ada Larangannya, Jabatannya Non-struktural",HYPE
"Viral, Video Anak SD di Tana Toraja Menangis Tak Kebagian Susu dari Gibran",REGIONAL
"Setrum Bersih, Kisah Melintas Abad PLTA Heritage",JEO
"Menuju Satu Dekade Memberi Manfaat, Pemerintah Terus Dorong KUR untuk Usaha Produktif",MONEY
"Desa Energi Berdikari Tampil di COP 29, Pertamina Berkomitmen Jaga Kelestarian Lingkungan di Masyarakat",NEWS
"Takut Tiba-tiba Bubar Lagi, Promotor Baru Bayar Liam dan Noel Gallagher Setelah Tur Reuni Oasis Selesai",HYPE
"Mengenang Prof Ichlasul Amal, Rektor UGM yang Mencintai Lingkungan",REGIONAL
"Terima Kunjungan Syaikhu-Ilham, Anies: Mudah-mudahan Ada Kemajuan di Jabar",NEWS
Pelaku Pembunuhan Wanita di Cikupa Simpan Jasad Korban 3 Hari di Rumah Kontrakan,NEWS
"Resep Es Buah, Hanya 2 Langkah Penyajian",FOOD
"Superstar Fitness Mendadak Tutup, 600 ""Member"" Merasa Tertipu",NEWS
"Pastikan Akan Lapor Harta ke LHKPN, Raffi Ahmad: Lagi Proses",HYPE
"Pembebasan Bea Masuk Susu Impor Dikeluhkan Peternak, Ini Kata Dirjen Bea Cukai",MONEY
"Normalisasi Ekowisata Bromo Dimulai 2025, Apa Saja yang Akan Berubah?",TRAVEL
"Menteri Komdigi: Banyak ""Global High Tech Companies"" Tertarik Kerja Sama Pelindungan Data",NEWS
Tersangka Korupsi Pembangunan Puskesmas Dompu Kota Ditahan,REGIONAL
"Tak Terbukti Bersalah, Tukang Ojek Laporkan Kapolres Parepare karena Ditahan Selama 6 Bulan",REGIONAL
"Danpuspom TNI Ungkap Keterlibatan 4.000 Prajurit dalam Judi ""Online"", Ini Penyebabnya",NEWS
"Rekaman Penjara Terbaru Charles Manson Dirilis, Ungkap Hal Mengejutkan",GLOBAL
Mengapa Orang Melakukan Hubungan Sosial? Ini Penjelasannya ....,SKOLA
Kemenkes Tegaskan Indonesia Serius Berantas TBC,HEALTH
"Jarang Diketahui, Makan Oatmeal Setiap Hari secara Berlebihan Bisa Picu 4 Penyakit Ini",TREN
Konsinyor: Penjelasan dan Perannya dalam Konsinyasi Bisnis,UMKM
[HOAKS] Warga Belanda Bertepuk Tangan Usai Kerusuhan di Amsterdam,CEK FAKTA
"Langkah Strategis Indonesia di COP29, Rehabilitasi dan Restorasi Hutan Terdegradasi",LESTARI
"Kampanye Akbar RK-Suswono Tak Dihadiri Ketum Partai KIM Plus, Golkar: Terbatas Waktunya",NEWS
Foto Syur Picu Suami Aniaya Istri di Gresik,REGIONAL
"Indonesia Vs Jepang, Pelatih Samurai Biru Puji Wajah Baru Garuda",BOLA
"Pabrik Onduline di Pasuruan Diresmikan, Telan Investasi Rp 150 Miliar",PROPERTI
"Puji Lawatan Luar Negeri Prabowo, Anies: Indonesia Kelihatan Berwibawa",NEWS
"Padamkan Kebakaran di Lenteng Agung, Warga Tak Sadar Penghuni Terjebak di Kamar",NEWS
Kemenag Akan Bentuk Ditjen Khusus Urusan Pesantren,NEWS
"13 Penambang Emas Ilegal di Perkebunan Sawit Sambas Ditangkap, Rugikan Perusahaan Rp 3,2 Miliar",REGIONAL
"Bidik Nasabah Menengah ke Atas, BTN Hadirkan Kartu Debit BTN Prospera",MONEY
"Kakak Anthony Martial Hadir di SUGBK, Menonton Indonesia Vs Jepang",BOLA
"Soal Kereta Otonom IKN, DJKA Kemenhub: Kita Tunggu Sampai Akhir Tahun",MONEY
Istana Tak Halangi Budi Arie Diperiksa soal Judi Online,NEWS
"6 Fakta Miss International Indonesia 2024 Sophie Kirana, Jadi Runner Up 4",LIFESTYLE
Uji Materi Kotak Kosong untuk Pilkada Selain Calon Tunggal Ditolak MK,NEWS
Ketahui Beragam Kandungan dan Manfaat Buah Ciplukan,HEALTH
"Benarkah Mendiamkan Anak Tantrum adalah Cara ""Parenting"" yang Tepat? Ini Kata Psikolog",TREN
Istana Sebut Dukungan Prabowo untuk Luthfi-Yasin sebagai Ketum Gerindra,NEWS
"CEO Nvidia Jensen Huang: Anda Tidak Akan Kehilangan Pekerjaan karena AI, tapi...",MONEY
Auditor BPKP Ungkap Rincian Kerugian Rp 300 Triliun Akibat Dugaan Korupsi di PT Timah,NEWS
Demo di Lebak Nyaris Rusuh Imbas Camat Minta Ibu-Ibu Cuhat Sambil Mandi,REGIONAL
6 Jenis Monstera yang Cantik dan Cocok untuk Dikoleksi,HOMEY
"Komentar dan Reaksi Giring Ganesha Nonton Film Ipar Adalah Maut, Adegan Aris Bikin Dirinya Tutup Telinga",HYPE
Berapa Biaya Administrasi Bank BCA per Bulan?,MONEY
"MG Pakai Baterai Lokal, Harga Mobil Listrik Bakal Turun?",OTOMOTIF
Pilkada 2024: Perempuan Dominasi Pemilih di Padang,REGIONAL
Final Ajang Modifikasi Mobil Ini Sukses Digelar di Surabaya,OTOMOTIF
"Kementan Ajukan Perpres Wajibkan Industri Serap Produksi Susu Peternak Lokal, Mentan: Mensesneg Setuju",MONEY
"Resep Salad Sayur Hijau, Cocok untuk Diet",FOOD
"Hasil Japan Masters 2024: Gregoria, Jonatan, dan 3 Ganda Putra ke Perempat Final",BOLA
"Berteduh di Warung Angkringan, Dua Pria di Grobogan Tewas Tersambar Petir",REGIONAL
LVRI Sebut Banyak Veteran yang Tak Punya Rumah hingga Akhir Hayatnya,NEWS
"Hadiri Kampanye Akbar, Relawan ""Gibranku"" Dukung Ridwan Kamil-Suswono",NEWS
"GOTO Gencar Garap AI Usai Rilis ""Sahabat-AI"", CEO NVidia Jensen Huang Beri Apresiasi",MONEY
"Kasus Tom Lembong Jadi Sorotan Anggota DPR, Anies: Kita Ingin Proses Hukum Berjalan Benar",NEWS
"10 Tips Liburan Hemat ke Thailand, Cintai Kantongmu",TRAVEL
"Main Game ""COD Warzone Mobile"" Kini Butuh HP yang Lebih Canggih",TEKNO
Ini yang Harus Dilakukan agar Warga Kolong Jembatan Pakin Bisa Bayar Sewa Rusun Usai Direlokasi,NEWS
"Awalnya Restoran di Paris, Raffi Ahmad dan Nagita Slavina Buka Cabang di Jakarta",HYPE
"PPN Naik Jadi 12 Persen, Sri Mulyani: APBN Harus Dijaga Kesehatannya",MONEY
"Kia Pamerkan Mobil Listrik Terbaru, Ada Model EV3 dan Mobil Konsep PV5",OTOMOTIF
Syaikhu-Habibie Harap Dukungan Pendukung Anies di Pilkada Jabar,NEWS
"Kenali Apa Itu Leptospirosis, Penyebab, dan Gejalanya",HEALTH
Survei Litbang Kompas Pilkada Jabar 2024: “Iket” Kepala Dedi Mulyadi Dulang Elektabilitas,TREN
"Studi: Lebih dari 800 Juta Orang di Dunia Mengidap Diabetes, Terbanyak di Negara Berpenghasilan Rendah dan Menengah",GLOBAL
Maksud dari Norma Agama Bersifat Universal,SKOLA
HUMI Akuisisi 1 Unit Kapal Tanker untuk Peremajaan Armada,MONEY
KPU Jaktim Mulai Distribusikan Surat Suara dari Gudang Induk ke Kecamatan,NEWS
"Indonesia Vs Jepang: Endo Sebut Lawan Garuda Bakal Susah, Sebut Perbedaan Moriyasu dan Slot",BOLA
"Hindari Mobil di Tikungan, Pikap Terjun ke Sungai di Kulon Progo, Satu Orang Terluka",REGIONAL
Survei Indikator: Elektabilitas Supian-Chandra dan Imam-Ririn Bersaing Ketat di Pilkada Depok,NEWS
Ahmad Syaikhu Ingin Anies Ikut Kampanye pada Pilkada Jabar,NEWS
Pengungsi Erupsi Lewotobi Kecewa Tak Bisa Bertemu Wapres Gibran,REGIONAL
[HOAKS] Tautan Pendaftaran BPJS Kesehatan Gratis,CEK FAKTA
"Kunjungi Trawas, Mojokerto, Risma Dengarkan Keluh Kesah Pedagang dan Masyarakat",REGIONAL
"Kemenperin Pantau Sritex yang Kekurangan Bahan Baku Produksi, Pastikan Tak Ada PHK",MONEY
Pemkab Karawang dan Bekasi Sepakati Akses ke Stasiun Kereta Cepat,REGIONAL
Pemprov Jakarta Diingatkan Tak Salurkan Bansos hingga Pilkada Selesai,NEWS
"Pabrik Tiner di Semarang Terbakar, Penyebab Masih Diselidiki",REGIONAL
"Presidensi Brasil, Sherpa G20 Indonesia Suarakan Kepentingan Negara Berkembang",NEWS
Pria yang Intimidasi Siswa SMA di Surabaya Ditangkap dan Jadi Tersangka,REGIONAL
Mercedes-Benz Masih Studi Soal Pasar Mobil Hybrid di Segmen Premium,OTOMOTIF
TVS Resmikan Diler ke-39 di Kudus,OTOMOTIF
12 Tanaman Sayur yang Tidak Boleh Ditanam Bersama,HOMEY
"Kasus Mayat Dicor di Belitung Timur, Korban Dibunuh oleh Kekasihnya karena Cemburu",REGIONAL
Pertamina Trans Kontinental Ajak Mahasiswa Berinovasi untuk Masyarakat Pesisir,MONEY
"Pegawai Kejagung Main Judol karena Iseng, Anggota DPR: Tidak Bisa Diterima",NEWS
Komdigi Pecat 10 Pegawai terkait Judi Online,NEWS
Mentan: Inpres Kewajiban Penyerapan Susu Lokal Dihapus karena Intervensi IMF pada 1998,MONEY
"Kronologi Pedagang Seblak Ditemukan Tewas Dicor di Lantai Rumah, Pelaku Ternyata Pacar Korban",REGIONAL
"Ramai soal SPBU di Sleman Ditutup karena Curang, Ini Kata Pertamina",TREN
"Apple Rilis Aplikasi Edit Video Final Cut Pro 11, Bawa Fitur Berbasis AI",TEKNO
"Tewas Terbakar di Rumahnya, Pria di Jagakarsa Luka Bakar 70 Persen",NEWS
Agak Laen dan Mencuri Raden Saleh Jadi Film Favorit Fadli Zon,HYPE
"Nasi Punel Khas Bangil Pasuruan: Lembut, Manis, Pedas dan Gurih",REGIONAL
"GoTo-Indosat Luncurkan ""Sahabat-AI"", Apa Itu?",MONEY
