Judul,Kelas
"Diharapkan Teruskan Profesi Orangtua, Pemkot Semarang Berikan Beasiswa bagi Anak Nelayan dan Petani",REGIONAL
Ini Rudal Jarak Jauh yang Bakal Digunakan Ukraina untuk Serang Rusia,GLOBAL
"Bastianini Sindir Aleix, Sebut Balapan Untuk Lindungi Martin",OTOMOTIF
"Prabowo Bakal Kirim Tim ke Brasil, Pelajari Program Makan Bergizi",NEWS
"Biaya Pengobatan Penyakit Kronis Sebabkan Dampak Finansial, Akses Kesehatan Terjangkau Jadi Kebutuhan Mendesak",MONEY
"Wamen PKP Fahri Hamzah Kunjungi Sumbawa Barat, Pjs Bupati Sampaikan Data Rumah Tak Layak Huni",REGIONAL
KPU Bali Targetkan Angka Partisipasi Pemilih 75 Persen pada Pilkada 2024,REGIONAL
Apakah Air Putih Dapat Menurunkan Asam Urat? Ini Penjelasannya...,HEALTH
Jemaah Haji 2025 Diberangkatkan ke Tanah Suci pada 2 Mei,MONEY
Apa Kabar Konsorsium 303?,NEWS
"Resep Sop Ayam Wortel, Hidangan Berkuah Hangat untuk Musim Hujan",FOOD
"Menikmati Es Krim di Rumah Oma Surabaya, Kedai Estetik yang Nyaman Buat Nongkrong",REGIONAL
"Belum Raih Kemenangan, Ini Dua Skenario Timnas Indonesia Lolos ke Piala Dunia 2026",TREN
"Jelang ""Fit and Proper"" Test Capim KPK, Poengky Indarti Mengaku Sudah Mendapat Banyak Masukkan",NEWS
"Duduk Perkara Reza Artamevia soal Dugaan Penipuan Bisnis Berlian Rp 18,5 Miliar",HYPE
3 Cagub Jakarta Tidak Bisa Jamin Warga Dapat Air Bersih untuk Minum,NEWS
"Kompolnas Ingatkan Polri, Putusan MK terkait Netralitas Pilkada Harus Dipatuhi",NEWS
"4 Pria Tasikmalaya Tersambar Petir, 1 Tewas Akibat Luka Bakar di Dada",REGIONAL
"Dari Penyanyi dan Kini Jadi Anggota DPR RI, Kekayaan Nafa Urbach Tercatat Mencapai Rp 20 Miliar",HYPE
"Palmeiras Tolak Neymar, Santos Jadi Opsi Pulang Sang Bintang Brasil",BOLA
Penggunaan Maggot untuk Olah Sampah Organik Jadi Peluang Ekonomi Baru,MONEY
Sekjen PBB Sebut Indonesia Mitra yang Sangat Strategis dan Berharga,NEWS
Seberapa Tahan Mobil CVT Dibandingkan dengan Manual?,OTOMOTIF
"Pilu Adik Kakak di Majalengka Dirantai karena Dituduh Mencuri, Sang Ayah Menyesal",REGIONAL
"Debat Pilkada Semarang 2024: Jadwal, Tema, dan Mekanismenya...",REGIONAL
Prabowo Bahas Kendala Pembiayaan Bensin Sawit Bersama Sekjen PBB di Brasil,MONEY
Dharma Pongrekun: Stop Impor Dokter Asing!,NEWS
"Diskon Skutik Bongsor 150 cc, Nmax Tembus Rp 800.000",OTOMOTIF
Uji Kelayakan dan Kepatutan Capim KPK di DPR Digelar Selama 4 Hari,NEWS
"Pesona Desa Wisata Jatimulyo di Kulon Progo, Juara 1 Desa Wisata Maju ADWI 2024",TRAVEL
"Sempat Terdampak Erupsi Lewotobi, Aktivitas Pembelajaran Sekolah di Sikka Kembali Normal",REGIONAL
"Debat Pilbup Subang: PSN hingga Jalan Rusak, 3 Paslon Berebut Panggung",REGIONAL
Litbang Kompas: Publik Harap Muhammadiyah Terus Jaga Toleransi Umat Beragama,NEWS
"Mengapa Anak Perempuan yang ""Fatherless"" Sering Bertemu Pria yang Salah?",LIFESTYLE
"Tiga Cagub Jakarta Kompak Tolak Retribusi Sampah, Apa Alasannya?",NEWS
"Advan ForceOne Rilis di Indonesia, PC AIO dengan AMD Ryzen 5 6600H",TEKNO
"Bocoran Mobil Listrik Geely di Indonesia, Model SUV",OTOMOTIF
"Daftar Pebalap dengan Gelar Juara Dunia MotoGP Terbanyak, Valentino Rossi Posisi Dua",TREN
DPR Diminta Kuliti Rekam Jejak Calon Pimpinan dan Dewan Pengawas KPK,NEWS
"Naik Rp 8.000 Per Gram, Ini Harga Emas Antam 18 November 2024",MONEY
"Beberok Terong, Makanan Khas Suku Sasak yang Jadi Andalan di Lombok",REGIONAL
Polandia Dukung Biden Izinkan Ukraina Pakai Senjata AS untuk Serang Wilayah Rusia,GLOBAL
"Kompaknya Suwono, Kun Wardana, dan Rano Karno: Tak Mau Ada Penggusuran dalam Konflik Agraria",NEWS
"Demokrasi Berisik, Jangan Putus Harapan",NEWS
"Prabowo Sebut PBB Hargai Sikap Indonesia soal ""Climate Change"": Kita Harap ""Net Zero Emission""",NEWS
"Cari Ikan di Sungai, Nelayan di Kaltara Dilaporkan Hilang",REGIONAL
CEK FAKTA: Dharma Pongrekun Sebut Covid-19 Membuat Jabar Jadi Provinsi Miskin,CEK FAKTA
"Sambut Natal, FlowerAdvisor Luncurkan Koleksi Hamper Limited Edition dengan Diskon hingga 15 Persen",HOMEY
Survei Litbang Kompas: Muhammadiyah Dinilai Bisa Jaga Netralitas Selama Pemilu 2024,NEWS
"Gurihnya Ampok Goreng ""Topping"" Ikan Teri di Kediri",REGIONAL
"IHSG Bergerak Fluktuatif Pagi Hari, Sektor-sektor Ini Menguat Paling Tinggi",MONEY
Modal Transaksi Rp 50.000 Bisa Dapat Mobil Listrik? Ini Caranya,ADVERTORIAL
Soto Ayam Masuk Daftar Sup Terenak di Dunia Versi CNN,FOOD
5 Kesalahan Merawat Tanaman Mawar yang Harusnya Dihindari,HOMEY
"DKI Jakarta dan Jawa Tengah Catat PHK Tertinggi, Apa Penyebabnya?",MONEY
Kemenhub Bakal Adakan Sertifikasi Kompetensi Sopir Truk,OTOMOTIF
"Catat, Ini Jadwal Seleksi PPPK 2024 Tahap 2",MONEY
"Resep Sop Oyong Misoa, Lauk Sehat saat Cuaca Dingin",FOOD
21 Instansi Pusat dan Daerah yang Sudah Rilis Pengumuman Hasil SKD CPNS 2024,TREN
Inggris Vs Irlandia 5-0: Harry Kane Puas atas Kualitas Generasi Baru,BOLA
"Terpilih Pimpin Aprindo, Solihin Komitmen Tingkatkan Peran Ritel di Perekonomian Nasional",ADVERTORIAL
"Makassar-Pekanbaru Usai, Daftar 20 Tim Final Meet The World With SKF Road to Gothia Cup",BOLA
Apakah Mata Minus Bisa Daftar SMA Taruna Nusantara?,EDUKASI
Harga Emas Terbaru Hari Ini 18 November 2024 di Pegadaian,MONEY
Apakah Mobil Bekas dari Rental Masih Layak Dibeli?,OTOMOTIF
Rencana Ridwan Kamil Jadikan Jakarta Utara Kawasan Ekonomi Dinilai Bakal Perparah Penurunan Tanah,NEWS
"Prabowo Dorong Sinergi Ekonomi Indonesia-Brasil, Nyatakan Ingin Gabung BRICS",NEWS
Nenek Bisu di Lampung Dibunuh Tetangga gara-gara Dituduh Bergosip,REGIONAL
NewT Mudahkan Pebisnis Kelola Uang Bisnis Ritel secara Efisien dan Aman,ADVERTORIAL
"112 Tahun Muhammadiyah, Litbang Kompas: 91 Persen Publik Anggap Syarikat Berkontribusi Positif",NEWS
Dampak Memakai Headset Terlalu Sering dengan Volume Tinggi yang Penting Dihindari,TEKNO
Kuasa Hukum Minta Tom Lembong Dihadirkan dalam Sidang Praperadilan Perdana,NEWS
"Diskon LCGC Jelang Akhir Tahun, Honda Brio Tembus Rp 25 Juta",OTOMOTIF
Studi Ungkap Jalan Kaki 10 Menit Bantu Turunkan Tekanan Darah Tinggi,HEALTH
"Keunggulan Desa Wisata Les di Bali, Juara Desa Wisata Terbaik ADWI 2024",TRAVEL
"6 Ide ""Styling"" Kemeja Putih untuk Perempuan",LIFESTYLE
Dankormar Sebut Presiden Prabowo Ingin Hadiri Puncak HUT Ke-79 Korps Marinir,NEWS
Ulik Fitur Unggulan Hyundai Ioniq 5 N di Sirkuit Mandalika,OTOMOTIF
[POPULER PROPERTI] BP Tapera Belum Kembalikan Tabungan Rp 1 Triliun Milik Pensiunan PNS,PROPERTI
"Mengapa ""Red Carpet"" Sering Dipakai Menyambut Tamu Penting? Ini Sejarahnya",TREN
"Di COP29, Wakil Menteri PPN Ungkap Indonesia dalam Posisi Tepat Pimpin Industri Baterai",LESTARI
"Merek Atau Merk, Mana Kata yang Benar?",SKOLA
"Calon Menkes AS dan Trump Makan McD Usai Janji ""Sehatkan Amerika""",GLOBAL
"Supermarket AEON Buka di Pakuwon Mall Bekasi, Ada Promo ""Buy 1 Get 1""",MONEY
Debat Kedua Pilbup Subang: Tagline Religius hingga Digitalisasi Pelayanan,REGIONAL
"Deretan Artis Beri Bantuan dan Galang Dana untuk Korban Lewotobi, Ada Andien Aisyah sampai Marion Jola",HYPE
"Putuskan Rujuk dengan Pedagang Singkong, Pinkan Mambo: Kok Tambah Ganteng Ya",HYPE
MWA UI: Sidang etik Tidak Harus Beri Konsekuensi Status Doktoral Bahlil Lahadalia,EDUKASI
"Beda dari Sebelumnya, Kemenag Pastikan Jemaah Haji Dapat Makanan Setiap Hari",NEWS
6 Tanaman Dalam Ruangan yang Baik untuk Kesehatan,HOMEY
"Lantai Data Center Microsoft Pakai Bahan Kayu, Ini Alasannya",TEKNO
"Sidang PK Jessica Wongso Dilanjutkan Hari Ini, Jaksa Akan Hadirkan Ahli",NEWS
"Dukung Kedaulatan Pangan, BGR Logistik Indonesia Perkuat Sinergi",MONEY
Ternyata Kendaraan Niaga yang Abai  Uji Laik Jalan Tanpa Ancaman Denda,OTOMOTIF
"Polisi Ungkap Kasus TPPO di Ende, Pelaku Rekrut Korban melalui Medsos",REGIONAL
Siapa Saja yang Bisa Daftar PPPK 2024 Periode 2?,EDUKASI
"CEK FAKTA: Pramono Anung Sebut Ada 1.527 Taman di Jakarta, Hanya Buka Sampai Sore",CEK FAKTA
Reaksi Ridwan Kamil Saat Masa Lalunya Dikulik-kulik Dharma dalam Debat Pilkada Jakarta,NEWS
Cara Membuat Akun SSCASN PPPK 2024 Tahap 2,MONEY
"Berkaca Kasus Firli, DPR Diminta Tak Pilih Pimpinan KPK yang Cacat Etik",NEWS
Ridwan Kamil Mengaku Akan Terus Belajar tentang Jakarta jika Terpilih Pimpin Jakarta,NEWS
"Profil Jorge Martin, Pebalap Juara Dunia MotoGP 2024",TREN
Kementerian PU Tambah Rambu Lalu Lintas di Titik Rawan Tol Cipularang,PROPERTI
"Harga Bahan Pokok Senin 18 November 2024, Harga Ikan Tongkol Naik",MONEY
"Senin Pagi, Gunung Lewotobi Muntahkan Guguran Lava Sejauh 1 Km",REGIONAL
"Tepis Man United, Viktor Gyokeres Tegaskan Komitmen kepada Sporting CP",BOLA
"Baru Diselenggarakan, Ini 5 Fakta Menarik Fan Meetup Lisa di Jakarta",HYPE
Cricket Indonesia Jadi Tuan Rumah Pelatihan Global Workforce ICC di Bali,BOLA
Ini Daftar Investor Swasta Nasional dan Asing yang Masuk IKN,IKN
"Steam Setop Dukungan Windows 7 dan 8, Gamer Diminta Upgrade ke OS Baru",TEKNO
"Jajal Hilux Rangga Campervan ke Bukit Pelangi, ibarat Innova Diesel",OTOMOTIF
Prakiraan Cuaca Semarang Hari Ini 18 November 2024 dan Besok : Sore Ini Hujan Ringan,REGIONAL
Kun Wardana: Kami Independen Tidak Punya Titipan Apa Pun,NEWS
"Pilkada Sumbawa, Novi-Talif Janjikan Beasiswa Kedokteran bagi Anak Desa",REGIONAL
Prakiraan Cuaca Yogyakarta Hari Ini 18 November 2024 dan Besok : Sore Ini Hujan Ringan,REGIONAL
Prakiraan Cuaca Solo Hari Ini 18 November 2024 dan Besok : Sore Ini Hujan Ringan,REGIONAL
Sastra Indonesia Mendunia pada Peringatan 100 Tahun AA Navis di Perancis,EDUKASI
"Diskon MPV Murah Jelang Akhir Tahun, Ertiga Rp 44 Juta, Avanza Rp 26 Juta",OTOMOTIF
"""Deja Vu"" Program Anies Saat Pramono Bilang ""Kumuhnya Dihilangkan, Kampung Dipertahankan""",NEWS
"AIA Rilis Asuransi Kesehatan Health X, Bisa Kontrol Premi Sesuai Gaya Hidup Sehat",MONEY
"Maung MV3 Siapkan Varian Elektrifikasi, Hybrid atau EV?",OTOMOTIF
"Ragam Kisah Anggota Komunitas Orang Kena PHK, Ada yang Pindah Profesi",LIFESTYLE
"Apa Manfaat Rutin Minum Air Rebusan Jahe, Kunyit, Serai, dan Lengkuas?",TREN
"Aksi Rilis Lagu Baru di Warteg Jadi Perbincangan, Dipha Barus Buka Suara",HYPE
"Kagetnya Warga di Pademangan, Temukan Tengkorak Manusia Saat Tengah Gali ""Septic Tank""",NEWS
"Memahami Coretax, Sistem Baru Administrasi Pajak",MONEY
Pramono Anung Usai Debat: Anak Abah dan Ahokers Bersatu Dukung Kami,NEWS
Lokasi Samsat Keliling di Jadetabek Hari Ini 18 November 2024,NEWS
Prabowo Targetkan RI Terapkan 100 Persen Energi Terbarukan dalam 10 Tahun,NEWS
Sekian Biaya Kuliah Jurusan Kedokteran di Universitas Kristen Petra,EDUKASI
"Mengintip Inovasi ""KlaperX"", Ciptaan Pemuda di Kulon Progo, Kembangkan Perangkap Hama di Lahan Pertanian",REGIONAL
AI Baru Buatan Induk ChatGPT Bisa Ambil Alih Komputer Pengguna,TEKNO
Biden Izinkan Ukraina Gunakan Senjata AS untuk Serang Jauh Wilayah Rusia,GLOBAL
"Transformasi Sistem Layanan Terpadu, BFI Finance Optimistis Aset Capai Rp 26 Triliun di Akhir 2024",MONEY
6 Tanaman Sayur yang Tumbuh Subur di Pot,HOMEY
Benny Santoso Sabet Gelar TCR Asia 2024 Setelah Seri Penutup di Makau,OTOMOTIF
"Reaksi Bagnaia Usai Gagal Juara Dunia MotoGP 2024, Ungkit Martin",BOLA
Prabowo Nyatakan Siap Kirim Pasukan Perdamaian ke Palestina ke Sekjen PBB,NEWS
Prabowo Ungkap Keinginan agar Indonesia Gabung BRICS sejak 2014,MONEY
Bagaimana Cara Mendeteksi Pneumonia? Ini Kata Pakar...,HEALTH
"Jorge Martin Juara MotoGP 2024, Berikut Daftar Lengkap Juara MotoGP dari Masa ke Masa",TREN
Program Pramono-Rano Tingkatkan RTH Jadi 30 Persen Tanpa Penggusuran Dinilai Kontradiktif,NEWS
Apa Bedanya Tilang Elektronik buat Angkutan Barang?,OTOMOTIF
"Basuki Hadimuljono Jadi Ketua Umum PP Kagama, Janji Jalankan Visi Misi",EDUKASI
"Soal Reklamasi, Pramono Janji Selektif Saat Lanjutkan Program Gubernur Terdahulu",NEWS
Prabowo: Bulan-bulan Pertama Menjabat Saya Harus Fokus Perbaiki Ekonomi Dalam Negeri,MONEY
"Diskon LSUV November 2024, BR-V Tembus Rp 55 Juta, XL7 Rp 35 Juta",OTOMOTIF
Saat Ridwan Kamil Seret Nama Ahok untuk Serang Pramono Anung pada Debat Pilkada Jakarta...,NEWS
"Tabrak Lari gara-gara Lakukan Aktivitas Seksual Sambil Nyetir, Pelaku: Saya Pikir Nabrak Tiang",REGIONAL
"Minat ke Perpustakaan Turun, Perguruan Tinggi Keagamaan Negeri Diminta Kembangkan e-Library",EDUKASI
"Kostum Nasional Miss Universe Indonesia Bertema Guardian Angel of Nusantara, ini Maknanya",LIFESTYLE
"6 Cara Seduh Teh yang Benar, Perhatikan Suhunya",FOOD
Spotify mulai Gaji Kreator Video Podcast,TEKNO
"Mobil Terlaris Oktober 2024, Avanza Berkuasa, BYD M6 Masuk 10 Besar",OTOMOTIF
7 Barang yang Harus Disingkirkan dari Kamar Mandi,HOMEY
Jenis-Jenis Kalimat Majemuk beserta Penjelasan dan Contohnya,SKOLA
"Rayakan HUT Ke-73, Direktur Sido Muncul Ungkap Tiga Kunci Sukses Sido Muncul",MONEY
"Hingga Triwulan Ketiga, KEK Serap Investasi Rp 242,5 Triliun",PROPERTI
Menyelisik Faktor Penurunan Harga Emas,MONEY
"5 Khasiat Minum Air Rebusan Kunyit Setiap Pagi, Apa Saja?",TREN
"Kepala Daerah Didesak Kelola Sampah TPA, Bukan Hanya Ditimbun",LESTARI
"Prabowo Bertemu Sekjen PBB di Brasil, Bahas Keamanan Pangan hingga Krisis di Palestina",NEWS
"Emosional, Jorge Martin Menangis di Lap Terakhir MotoGP Barcelona 2024",OTOMOTIF
"Pelemahan IHSG Berpotensi Berlanjut, Cermati Saham-saham Berikut",MONEY
"Prakiraan Cuaca Batam Hari Ini Senin 18 November 2024, dan Besok : Tengah Malam Ini Hujan Ringan",REGIONAL
"Prakiraan Cuaca Balikpapan Hari Ini Senin 18 November 2024, dan Besok : Tengah Malam Ini Hujan Ringan",REGIONAL
"Pakar Kritik Debat Ketiga Pilkada Jakarta, Tiga Paslon Dinilai Masih Kurang Memahami Masalah Jakarta",NEWS
"Prakiraan Cuaca Morowali Hari Ini Senin 18 November 2024, dan Besok : Siang Ini Hujan Ringan",REGIONAL
ETLE Angkutan Barang Bakal Diterapkan di 3 Lokasi,OTOMOTIF
"Prakiraan Cuaca Tulungagung Hari Ini Senin 18 November 2024, dan Besok : Malam Ini Hujan Ringan",REGIONAL
Kata-kata Jorge Martin Usai Jadi Juara Dunia MotoGP 2024,BOLA
[POPULER OTOMOTIF] Pengemudi Truk dan Bus di China Selalu Bawa Termos untuk Keselamatan | Hasil MotoGP Barcelona 2024 | Pilihan Oli Mesin yang Bisa Bikin Mobil Irit BBM,OTOMOTIF
28 Akses Gerbang Tol Jakarta yang Kena Ganjil Genap,OTOMOTIF
"Ridwan Kamil Ingin Pindahkan Balai Kota ke Jakut, Pengamat Ingatkan Akses di Sana yang Terburuk",NEWS
"Jorge Martin Raih Juara Dunia Perdana MotoGP, Berikut Klasemen Akhir MotoGP 2024",TREN
Haji 2025 Diberangkatkan mulai 2 Mei ke Tanah Suci,NEWS
"Debat Pilkada Temanggung, ""Adadia"" Tawarkan Paslon 02 Jadi Staf Ahli, Wibowo Joged ""Oke Gas""",REGIONAL
Lokasi SIM Keliling di Jakarta Hari Ini 18 November 2024,NEWS
"Program Kolam Pipi Monyet dan Beton Berpori Dharma Pongrekun untuk Atasi Banjir, Apa Itu?",NEWS
Debat Kedua Pilgub Riau: Abdul Wahid Tantang M Nasir Jelaskan Astacita Prabowo,REGIONAL
[KABAR DUNIA SEPEKAN] Pembocor Dokumen Rahasia AS Dipenjara | Mike Tyson Vs Jake Paul,GLOBAL
"Erick Thohir Bicara Tolok Ukur Jepang, Progres Timnas, hingga Misi Bangkit Vs Arab Saudi",BOLA
Ganjil Genap Jakarta Kembali Berlaku di 25 Ruas Jalan Ini,OTOMOTIF
"Yakinkan Pemilih di Kampanye Akbar, Cagub Kalteng Abdul Razak Sebut Satu Almamater dengan Jokowi",REGIONAL
Berapa Lama WhatsApp Diblokir karena Spam? Ini Dia Penjelasannya,TEKNO
"Debat Pilkada Kalsel, Paslon Singgung Investor Tak Akan Masuk Kalsel jika Korupsi Masih Tinggi",REGIONAL
Prakiraan BMKG: Wilayah yang Berpotensi Hujan pada 18-19 November 2024,TREN
Underpass Joglo Direncanakan Fungsional 10 Desember 2024,PROPERTI
RS Harapan Kita Sukses Operasi Jantung Robotik Pertama di Indonesia,HEALTH
Kenaikan PPN 12 Persen: Ancaman Baru bagi Pertumbuhan Ekonomi?,MONEY
"Wacana Ridwan Kamil Pindahkan Balai Kota, Solusi atau Mengada-ada?",NEWS
Sidang Perdana Praperadilan Tom Lembong Digelar Hari Ini di PN Jaksel,NEWS
Jadwal Timnas Indonesia Vs Arab Saudi di Kualifikasi Piala Dunia 2026,BOLA
Menikmati Sate Kelinci di Pinggir Telaga Sarangan,REGIONAL
DPR Mulai Seleksi Capim dan Dewas KPK Hari Ini,NEWS
Jejak Kelam Kebijakan: Korupsi dan Kontroversi di Balik Kasus Tom Lembong,NEWS
[POPULER TREN] Pengumuman SKD CPNS 2024 | Apakah Pelaku Selingkuh Bisa Dipidana?,TREN
Harga Sewa Rumah Ukuran Besar di Jakarta Pusat Turun hingga 18 Persen,PROPERTI
Prakiraan Cuaca Jakarta Hari Ini Senin 18 November 2024 dan Besok: Malam Ini Hujan Ringan,NEWS
"Dharma Soroti Sepinya Teras Cihampelas, Ridwan Kamil: Pengganti Saya Tidak Melanjutkan",NEWS
"Hasil UEFA Nations League: Inggris Pesta Gol, Perancis Permalukan Italia",BOLA
"[POPULER JABODETABEK] Kode Keras Anies dan Prabowo pada Pilkada Jakarta | ""Perang Terbuka"" Terakhir Pilkada Jakarta 2024",NEWS
"Ini Jadwal Vaksin PCV Rekomendasi IDAI, Cegah Pneumonia pada Anak",HEALTH
[POPULER NASIONAL] Bawaslu Kirim Surat ke TNI-Polri soal Putusan MK | Cerita Mahfud MD Dibantu Luhut saat Konflik Cicak-Buaya,NEWS
"Hasil Italia Vs Perancis: Sundulan Rabiot Mematikan, Bungkam Azzurri di San Siro",BOLA
"Hasil Timnas Inggris Vs Irlandia 5-0, Pesta Gol Debut Bawa Three Lions Promosi",BOLA
Penyebab Eliano Reijnders Belum Masuk Skuad 23 Pemain Timnas Indonesia,BOLA
"Apa Itu Pendapatan Bersih? Pengertian, Rumus, dan Cara Menghitungnya",MONEY
Gresini Racing Kumpulkan Poin Penting di MotoGP Barcelona 2024,OTOMOTIF
"Indonesia Vs Arab Saudi, Herve Renard Bicara Pentingnya Meraih Tiga Poin",BOLA
"Kapal Mati Mesin di Laut Aru Maluku, 27 Penumpang Dievakuasi",REGIONAL
Lapor SPT Tahunan Wajib Pajak Akan Lebih Mudah Mulai 2025,MONEY
"Debat Pilkada Kalsel, Dua Paslon Adu Program Pembangunan",REGIONAL
"Dharma Pongrekun: Mas Pram, Ratusan Miliar untuk Pedagang adalah Usul yang Sangat Berbahaya",NEWS
"Kapal Tongkang Terbakar di Bangkalan, 17 Orang Selamat Usai Melompat ke Laut",REGIONAL
"Debat Pilkada Temanggung Bahas Tembakau, Ini Janji Para Paslon",REGIONAL
2 Misteri Stupa Induk Candi Borobudur yang Memicu Perdebatan Ahli,REGIONAL
Penyelundupan Ratusan Kulit Ular dan Biawak dari Riau Digagalkan di Lampung,REGIONAL
Cara Mudah Bayar Netflix lewat BCA Mobile,MONEY
"Bojan Hodak: Timnas Indonesia Harus Bangkit, Arab Saudi Punya Kelemahan",BOLA
"Dedi Mulyadi Kampanye di Tasikmalaya, Dukung Penuh Viman-Dicky",REGIONAL
"Juara Dunia MotoGP 2024, Helm Alpinestars Jorge Martin Jadi Sorotan",OTOMOTIF
Cabup Blora Arief Rohman Ungkap Isi Obrolan Bersama Jokowi dan Lutfhi-Yasin,REGIONAL
"Cak Lontong, Anang-Ashanty, hingga Ria Ricis Hadiri Debat Ketiga Pilkada Jakarta 2024",NEWS
"Pramac Racing, Tim Satelit yang Bawa Jorge Martin Juara Dunia MotoGP",OTOMOTIF
"Jadwal MotoGP 2025, GP Indonesia Digelar 3-5 Oktober 2025",OTOMOTIF
Ridwan Kamil Akui Ada Krisis Lingkungan di Jawa Barat,NEWS
"Swalayan di Situbondo Terbakar, 10 Siswi Magang Dibawa ke RS",REGIONAL
DPR Soroti Ketidakseimbangan Kontribusi Apple ke Perekonomian RI,MONEY
Anak Abah dan Ahokers Sepakat Dukung Pramono-Rano Karno pada Pilkada Jakarta,NEWS
"India Sukses Uji Coba Rudal Hipersonik Bikinan Sendiri, Masuk Daftar Negara Elite",GLOBAL
Pramono: Gagasan Anies Akan Saya Lanjutkan Meski Beda Fraksi,NEWS
"Ridwan Kamil: Gubernur Paling Brutal soal Penggusuran adalah Ahok, dari Partai Mas Pramono",NEWS
CEK FAKTA: Pongrekun Sebut Dokter Indonesia Lebih Jago Dibanding Negara Asing,CEK FAKTA
"Ingatkan Rano Karno soal SPBU Terapung, Dharma: Transaksi BBM Ilegal di Tengah Laut Bukan Lagi Rahasia",NEWS
"Pramono Anung: Catat Omongan Saya, kalau Jadi Gubernur Tidak Akan Menggusur!",NEWS
"Pilkada Tasikmalaya, Doel Sumbang Meriahkan Kampanye Viman-Dicky",REGIONAL
"Seduh Milo dengan Cara Baru, Berikut Resep Lengkapnya",FOOD
"Dharma Pongrekun: Saya Mantan Penyidik, Proyek Suka ""Diada-adain""",NEWS
"Ridwan Kamil Tanya Efektivitas Waduk di Jabar, Dharma: Belum Terasa Faedahnya",NEWS
Daftar Juara Dunia MotoGP Era Modern Sejak 2002 - 2024,OTOMOTIF
11 Momen Penting Jorge Martin di MotoGP 2024,OTOMOTIF
Desa Wisata Les di Buleleng Bali Jadi Desa Wisata Terbaik ADWI 2024,TRAVEL
"Ditanya Rano Soal Kerusakan Ekosistem Jawa Barat, Dharma Pongrekun Langsung Menoleh ke Ridwan Kamil",NEWS
"ABK Ukraina Sakit, Kapal MV Port Nara Minta Pertolongan di Selat Karimata",REGIONAL
Hasil MotoGP Barcelona 2024: Jorge Martin Juara Dunia,BOLA
"Punya Kekayaan Rp 1 Triliun, Alasan Will.i.am Tak Punya Rumah dan Pilih Tinggal di Hotel",HYPE
"RK Ingin Pindahkan Balai Kota ke Jakarta Utara, Pramono: Apakah Ini Bagian dari Imajinasi?",NEWS
Eliano Reijnders Berjuang Demi Tempat di Timnas Indonesia,BOLA
"Pramono Anung: Urusan IKN, Saya Lebih Terlibat dari Ridwan Kamil",NEWS
"Pramono Tanya Imajinasi Pemindahan Balai Kota, Ridwan Kamil: IKN Juga Datang dari Imajinasi!",NEWS
"Ridwan Kamil Angkat Kisah Mbak Ade, Janji Renovasi Rumah untuk Gen Z",NEWS
Verdonk Soal Timnas Indonesia Sering Kedatangan Pemain Baru: Komunikasi Terkadang Sulit,BOLA
"Jokowi Kampanye Mendadak di Blora, Disambut Antusias Warga",REGIONAL
"Seremoni Juara Dunia MotoGP 2024 Jorge Martin, ""Hasta La Vista, Baby""",OTOMOTIF
Rano Karno Ingin Tambah Sumur Resapan dan Normalisasi untuk Atasi Banjir di Jakarta,NEWS
Doku Travel Fest Tawarkan Diskon hingga 70 Persen,MONEY
Kun Wardana Akan Manfaatkan AI untuk Atasi Banjir di Jakarta,NEWS
"Erick Thohir Pertegas Kesiapan Mundur, Akan Evaluasi Besar-besaran Usai Arab Saudi",BOLA
Petani di Grobogan Tewas Tersengat Jebakan Tikus yang Dipasang Sendiri,REGIONAL
Rano Karno Tak Ingin Penataan Kampung Kumuh Menjauhkan Warga dengan Mata Pencahariannya,NEWS
"CEK FAKTA: Suswono Sebut Kerugian Ekonomi akibat Banjir Capai Rp 2,1 Triliun",CEK FAKTA
"Klasemen Akhir MotoGP 2024, Martin Unggul 10 Poin Atas Bagnaia",OTOMOTIF
Meniti Makna Jembatan,TREN
"Bebas Biaya Admin, Ini Syarat dan Cara Membuat Rekening TabunganKu BCA",MONEY
"Atasi Konflik Agraria, Suswono Minta BUMD Bangun Hunian Tanpa Ambil Untung",NEWS
Kun Tawarkan Program Beton Berpori untuk Atasi Banjir di Jakarta,NEWS
Kun Wardana: Retribusi Sampah Membebankan Masyarakat,NEWS
3 Cawagub Kompak Tolak Retribusi Sampah di Jakarta,NEWS
"Transformasi Teknologi, BFI Finance Kurangi 1.018 Karyawan Sepanjang 2024",MONEY
CEK FAKTA: Ridwan Kamil Siapkan Program Renovasi Rumah seperti Jabar,CEK FAKTA
Suswono Janji Tidak Akan Ada Lagi Penggusuran di Jakarta,NEWS
"Juara Dunia MotoGP 2024, Perpisahan Manis Martin Bersama Ducati",OTOMOTIF
Resep Kimbab untuk Bekal ke Kantor,FOOD
"Dharma Pongrekun: Jangan Anggap Banjir Itu Musibah, tapi Rezeki dari Tuhan",NEWS
Mitsubishi dan Vasanta Tawarkan Rumah Rp 700 Jutaan di Sawangan,PROPERTI
"Dharma: Dengan Kolam Pipi Monyet, Warga Tak Perlu Lagi Beli Air Galon",NEWS
"Ramai soal Pemegang KIS Dapat Bansos Tunai, Benarkah? Ini Kata BPJS",TREN
"Tak Setuju Retribusi, Rano Karno Ingin Sampah Jadi Rezeki buat Warga",NEWS
Pramono Anung Akan Batasi Penggunaan Air Tanah di Mal Besar Jakarta,NEWS
"Indonesia Vs Arab Saudi, Kevin Diks Kecil Kemungkinan Bermain",BOLA
Ridwan Kamil Ungkap Kontras Sudirman-Thamrin dan Kawasan Kumuh Jakarta,NEWS
Nippon Paint Hadirkan Cat Interior dengan Spesifikasi Setara untuk Rumah Sakit,HOMEY
"Profil Jorge Martin, Martinator Sang Juara Dunia MotoGP 2024",OTOMOTIF
Rano Karno: Retribusi Sampah di Jakarta Tidak Diperlukan jika Tata Kelolanya Sudah Benar,NEWS
"Jorge Martin Samai Rekor Valentino Rossi, Tim Satelit yang Juara Dunia",OTOMOTIF
"Pramono Anung Janjikan Transportasi Umum Gratis dan ""Ride and Park"" untuk Warga Jakarta",NEWS
Bagaimana Cara Menghapus Riwayat Hitam BI Checking?,MONEY
DI Karangtalun Bisa Tingkatkan Produktivitas Pangan Jateng dan Yogya,PROPERTI
"Ridwan Kamil Bawa Mbak Ade ke Debat, Soroti soal Hunian Layak yang Sulit Didapat Gen Z",NEWS
CEK FAKTA: Dharma Pongrekun Sebut Pandemi Jadi Strategi Asing Kuasai Kedaulatan,CEK FAKTA
Dharma Pongrekun Bakal Lanjutkan Normalisasi dan Naturalisasi Sungai di Jakarta,NEWS
"3 Cagub Jakarta Bakal Lanjutkan ""Giant Sea Wall""",NEWS
"Hasil MotoGP Barcelona 2024, Jorge Martin Juara Dunia!",OTOMOTIF
Kata Dokter Kipas Angin dan Mandi Malam Tidak Sebabkan Pneumonia,HEALTH
Juru Bicara Hizbullah Mohammed Afif Tewas dalam Serangan Israel di Beirut,GLOBAL
"Mayat Bayi Ditemukan di Sungai Kebon Jengkol Sukabumi, Ada Memar pada Leher",REGIONAL
"Akun Facebook Dedi Mulyadi ""Dibajak"" Selama Setahun, Kerap Unggah Konten Merugikan",REGIONAL
"Dharma Pongrekun: Tidak Perlu Ada Pembatasan Air, yang Perlu Dihentikan Korupsinya",NEWS
"Indonesia vs Arab Saudi, Calvin Verdonk: Wajib Menang",BOLA
Ridwan Kamil Bakal Tanam 3 Juta Pohon untuk Turunkan Suhu Jakarta 2 Derajat,NEWS
"Kostum Nasional Miss Universe Vietnam, Bawa Dinasti Nguyen ke Atas Panggung",LIFESTYLE
"Nobu Bank Gandeng SRC, Permudah Akses Permodalan untuk UMKM Toko Kelontong",MONEY
Dharma Pongrekun Bakal Kurangi Macet di Jakarta dengan Teknologi Tanpa Lampu Merah,NEWS
"Kurangi Polusi, Ridwan Kamil Mau Terapkan ""Work From Home"" Bergiliran di Jakarta",NEWS
"Ridwan Kamil Tawarkan Program ""Carbon Trading"" untuk Atasi Polusi di Jakarta",NEWS
Bagaimana Cara Mengubah Nomor Kursi di Kereta? Ini Penjelasan KAI,TREN
"Miliki 11 Juta Pengikut, Akun Facebook KDM Dikuasai Pihak Tak Bertanggung Jawab",NEWS
Indonesia vs Arab Saudi: Verdonk Ungkap Suasana Ruang Ganti Usai Dikalahkan Jepang,BOLA
Ridwan Kamil Janji Berikan Insentif untuk Ojol agar Beralih ke Motor Listrik,NEWS
"CEK FAKTA: Ridwan Kamil Sebut Siap Turunkan Polusi seperti Medellin, Kolombia",CEK FAKTA
"Ridwan Kamil: Pembangunan ""Giant Sea Wall"" Harus Berkeadilan, Kuncinya Dialog",NEWS
CEK FAKTA: Pernyataan Pramono Anung soal Ruang Terbuka Hijau,CEK FAKTA
"Dharma Pongrekun Ingatkan Nasib Nelayan di Tengah Proyek Giant Sea Wall, Rugi Rp 26 Juta Per Hari",NEWS
Ridwan Kamil Mau Perbanyak Ruang Kerja di Pinggir Kota Jakarta,NEWS
"Kembali Menyanyi, Ira Swara Menangis Ungkap Sempat Alami Kesulitan Ekonomi",HYPE
Ciri Cabai yang Bagus untuk Bikin Sambal Pedas Saat Musim Hujan,FOOD
"Ingatkan Potensi Pandemi di Masa Depan, Dharma Pongrekun: Tanda-tandanya Jelas",NEWS
"Jika Terpilih, Pramono Anung Janji Perluas Ruang Terbuka Hijau di Jakarta Jadi 30 Persen",NEWS
"Hati-hati, Olahraga Outdoor Bisa Memicu Kekambuhan pada Pengidap Asma",LIFESTYLE
Pramono Anung Usulkan Giant Mangrove Wall sebagai Solusi Ekologis untuk Jakarta,NEWS
"Debat Pilkada Temanggung, Para Paslon Janjikan Pembangunan Infrastruktur dan Revitalisasi Alun-alun",REGIONAL
"Arab Saudi Sudah Eksekusi 101 Warga Negara Asing, Hampir 3 Kali Lipat Dibanding 2023, Apa Sebabnya?",GLOBAL
Pramono Anung Bakal Lanjutkan Program Sumur Resapan untuk Atasi Banjir,NEWS
