Judul,Kelas
Penyebab Seringnya Terjadi Kecelakaan di Tol Cipularang,OTOMOTIF
"Jangan Main HP Sambil BAB, Begini Dampaknya untuk Kesehatan",TEKNO
"Prakiraan Cuaca Malang Hari Ini Kamis 14 November 2024, dan Besok : Pagi ini Cerah",REGIONAL
"Rujak Cingur Pasuruan, ""Bukan Rujak Cingur Biasa""",REGIONAL
Bareskrim Polri Tangkap Pegawai Honorer yang Produksi Puluhan Situs Video Porno,NEWS
[POPULER GLOBAL] Tentara Korut di Rusia | Pembocor Dokumen Rahasia AS Dipenjara,GLOBAL
"Seorang Perempuan di Sidoarjo Ditemukan Tewas di Kamar, Diduga Dibunuh Anak Kandung",REGIONAL
Koperasi Diharapkan Jadi Bagian Distribusi Program Makan Bergizi Gratis,MONEY
Kenapa Merek Ban Michelin Bisa Memberi Rating Restoran? Ini Alasannya,TREN
"Kolaborasi Lintas Lembaga dalam Melawan Judi ""Online"": Apa Hasilnya Sejauh Ini?",NEWS
"Prakiraan Cuaca Denpasar Hari Ini Kamis 14 November 2024, dan Besok : Siang ini Hujan Ringan",REGIONAL
"Fakta Kecelakaan Tol Cipularang Km 92, Rem Truk Masih Normal",OTOMOTIF
"Poin Penting Pertemuan Prabowo dan Joe Biden: Makan Bergizi, Palestina, hingga Nuklir",NEWS
Lokasi SIM Keliling di Jakarta Hari Ini 14 November 2024,NEWS
"Prakiraan Cuaca Medan Hari Ini Kamis 14 November 2024, dan Besok : Siang ini Hujan Ringan",REGIONAL
"Awas Macet, Simak Rekayasa Lalu Lintas di Kawasan Monas Hari Ini",OTOMOTIF
"Distributor Gelapkan Ratusan Ton Pupuk Bersubsidi di Kalteng, Dipakai untuk Kebun Pribadi",REGIONAL
Mengapa Bahlil Beranggapan Kelulusannya Tidak Ditangguhkan UI?,NEWS
"Tak Diketahui Warga, Kebun Ganja Milik Pria di Cengkareng Ada di Atas Genteng",NEWS
"Prabowo Bertemu Menhan AS Lloyd Austin di AS, Bahas Kerja Sama dan Tukar Informasi",NEWS
"Pekerja Kena PHK Bisa Klaim JKP BPJS Ketenagakerjaan, Apa Saja Manfaatnya?",MONEY
"[POPULER OTOMOTIF] Bongkar Separator Busway, Pengendara Terancam Penjara 2 Tahun | Karoseri New Armada Rilis Bodi Skylander Mesin Depan | Penjualan Mobil Terancam Lesu Lagi karena PPN 12 Persen",OTOMOTIF
7 Hal yang Perlu Diketahui Sebelum Liburan ke Singapura,TRAVEL
BMKG: Wilayah Berpotensi Hujan Lebat pada 14-15 November 2024,TREN
Kementan Gandeng Raffi Ahmad untuk Tingkatkan Minat Generasi Muda di Bidang Pertanian,MONEY
"Efektivitas Pemberantasan Judi ""Online"": Apakah Upaya Pemerintah Telah Berjalan Optimal?",NEWS
"Pabrik Pohon Natal Terbesar di Indonesia Resmi Berdiri di Kendal, seperti Apa Rencananya ke Depan?",REGIONAL
"Jubir Sebut Ide Ridwan Kamil Sediakan Alat ""Gym"" di Ruang Terbuka Menyambung dari Program Ahok",NEWS
Kedekatan Pemain Menjadi Keunggulan Ruben Amorim di MU,BOLA
"Kebingungan di Era Digital, Kompleksitas Layanan Pengaduan Publik",NEWS
"[POPULER JABODETABEK] Kala Ridwan Kamil Ingin Sediakan Alat ""Gym"" di Pinggir Jalan | Masuk Jalur Transjakarta, Puluhan Motor-Mobil Terjebak Berhenti di Halte Jembatan Gantung",NEWS
"Warga Cengkareng Berkebun Ganja di Rumah, Ada 40 Tanaman dalam 16 Pot",NEWS
"Raperda Pertambangan Minerba Disahkan, Pemprov Jateng Siap Tertibkan Galian C Ilegal",REGIONAL
Kecelakaan Motor di Magelang: Ibu Hamil dan Anak Balita Jatuh ke Jurang Sedalam 20 Meter,REGIONAL
Survei Litbang Kompas Pilgub Jabar 2024: Pengangguran dan Kemiskinan Harus Segera Diselesaikan,REGIONAL
"Mbappe Absen, Deschamps Fokus pada Pertandingan Perancis Vs Israel",BOLA
"Main di Sungai, Bocah di Makassar Ditemukan Tewas Tenggelam",REGIONAL
Bahlil Mau Lapor Prabowo soal 3 Formulasi Penyaluran Subsidi Energi,MONEY
[POPULER TREN] Iuran BPJS Kesehatan Bakal Naik Tahun Depan | Potensi Gempa Sesar Opak,TREN
Survei Litbang Kompas Pilgub Jabar 2024: Visi-Misi Bukan Alasan Utama Warga Tentukan Pilihan,REGIONAL
Poin-poin Penting dari Pembicaraan Prabowo dan Joe Biden,NEWS
"Prakiraan Cuaca Morowali Hari Ini Kamis 14 November 2024, dan Besok : Pagi Ini Berawan",REGIONAL
Kondisi Cedera Ivar Jenner dan Jordi Amat Jelang Laga Melawan Jepang,BOLA
Petani di Jambi Tewas Terinjak Gajah Saat Mengusirnya dari Kebun,REGIONAL
"Prakiraan Cuaca Balikpapan Hari Ini Kamis 14 November 2024, dan Besok : Sore Ini Hujan Ringan",REGIONAL
"Penipu Proyek Tender Pemkot Jaktim Gunakan Sebagian Rp 5,8 Miliar untuk Bayar Utang",NEWS
Pemkab Flores Timur Siapkan Lahan 100 Hektar untuk Relokasi Warga Lereng Gunung Lewotobi Laki-laki,REGIONAL
"Debat Penutup Pilkada Kabupaten Magelang, ""Satria"" Janjikan Aparatur Desa Gaji Ke-13 dan 14, ""Progress"" Buat Database Desa",REGIONAL
"Prakiraan Cuaca Tulungagung Hari Ini Kamis 14 November 2024, dan Besok : Pagi Ini Cerah",REGIONAL
"Indonesia Vs Jepang, Mees Hilgers Minta Maaf dan Kirimkan Doa",BOLA
"Prakiraan Cuaca Batam Hari Ini Kamis 14 November 2024, dan Besok : Pagi Ini Hujan Ringan",REGIONAL
"Menikmati Kupang Lontong Cak Kartolo, Kuliner Legendaris Sidoarjo yang Tak Pernah Sepi Pembeli",REGIONAL
Oknum Jaksa di Jombang Diduga Terima Aliran Dana dari Terdakwa Kasus Korupsi,REGIONAL
Pemerintah Ajak ATTMI Bersinergi agar Perjalanan Umrah Tumbuh,MONEY
"Survei Litbang Kompas Pilgub Jabar 2024: Pemilih PKB Terbelah? Dedi-Erwan Raup 55,6 Persen",REGIONAL
"Debat Pilkada Kabupaten Magelang Bahas Pariwisata, ""Satria"" Mudahkan Pengusaha Bangun Hotel, ""Progress"" Dorong Riset",REGIONAL
[POPULER NASIONAL] Direktur CIA Datangi Prabowo dan Lakukan Pertemuan Tertutup | Mutasi 55 Personel Polri,NEWS
Jadwal dan Link Live Streaming Indonesia Vs Jepang di Kualifikasi Piala Dunia 2026,TREN
Jus Nanas untuk Penyakit Apa Saja? Berikut 8 Daftarnya…,HEALTH
"[POPULER MONEY] Apple Tak Lunasi Kekurangan Investasi Rp 300 Miliar Padahal Untung Rp 30 T | Ini Dampak Kebijakan ""America First"" Trump ke Ekonomi RI",MONEY
"Survei Litbang Kompas Pilgub Jabar 2024: Suara PKS Terbelah? 50,8 Persen Pilih Dedi-Erwan",REGIONAL
"Indonesia Vs Jepang, Memori Witan Lawan Samurai Biru",BOLA
Shin Tae-yong Panggil 16 Pemain Timnas Indonesia untuk Piala AFF 2024,BOLA
Yance Sayuri: Motivasi Kembar bersama Yakob di Timnas,BOLA
"Survei Litbang Kompas Pilgub Jabar 2024: 77,3 Persen Pemilih PDIP Dukung Dedi-Erwan, Suara Terbelah?",REGIONAL
Timnas Indonesia Harus Waspada: Rekor Koki Ogawa yang Menakutkan,BOLA
Lirik dan Chord Thank You for the Venom – My Chemical Romance,HYPE
"Lirik dan Chord Lagu It’s Not a Fashion Statement, It’s a Deathwish – My Chemical Romance",HYPE
"Survei Litbang Kompas Pilgub Jabar 2024: Elektabilitas Dedi-Erwan Tinggi di Kelompok Pemilih PKB, PDI-P, dan PKS",REGIONAL
Lirik dan Chord Cemetery Drive – My Chemical Romance,HYPE
Lirik dan Chord Lagu Interlude – My Chemical Romance,HYPE
"Dedi-Erwan Unggul Telak di Semua Wilayah, Peneliti Litbang Kompas: Ini Anomali",REGIONAL
Survei Litbang Kompas Pilgub Jabar 2024: Dedi-Erwan Unggul Telak di Semua Segmen Pemilih,REGIONAL
5 Contoh Penggunaan Cloud Computing dalam Kehidupan Sehari-hari,TEKNO
Survei Litbang Kompas Pilgub Jabar: Mengapa Elektabilitas Dedi Mulyadi Jauh Tinggalkan 3 Pesaingnya?,REGIONAL
Survei Litbang Kompas Pilgub Jabar 2024: Elektabilitas Dedi Mulyadi Unggul Telak 65 Persen,REGIONAL
Pesan Tijjani Reijnders untuk Eliano Jelang Piala Dunia 2026,BOLA
"Marselino ""Enjoy"" di Inggris, Berjuang Mati-matian demi Tampil di Tim Utama",BOLA
"Resmi, Persib Ajukan Perubahan Jadwal Laga Melawan Bali United",BOLA
"Bobby Sebut Anggaran untuk Wilayah Kecil karena Suara Kalah, Edy Membantahnya",REGIONAL
"Kembali Gabung Timnas Indonesia, Yakob Sayuri Siap Buktikan Diri",BOLA
Cinema XXI Resmi Terima Sertifikat Halal untuk Produk Makanan dan Minuman di Bioskop,MONEY
Tanggal 15 November 2024 Memperingati Hari Apa?,NEWS
Penerapan Responsible Financing Dipandang Bikin Saham BNI Menarik,MONEY
Judi Online: Dampak Negatif yang Merugikan Masyarakat,MONEY
Debat Pilgub Sumut: Edy Rahmayadi-Hasan Singgung Pemimpin Tak Bermoral,REGIONAL
Gibran Borong Bakso dan Bagikan di Pemukiman Padat Penduduk di Makassar,REGIONAL
Bobby Nasution Minta Maaf ke Edy Rahmayadi di Akhir Debat Pilgub Sumut,REGIONAL
"5 Pekerjaan ""Hijau"" Bergaji Tinggi dan Tingkat Stres Minim",MONEY
"Hadiri Penutupan Sidang Raya PGI di Toraja Utara, Gibran Tekankan Pentingnya Jaga Toleransi",REGIONAL
Saling Sindir Edy Rahmayadi dan Bobby Nasution Soal Air Bersih di Medan,REGIONAL
Momen Bobby Nasution Tak Diizinkan Jawab Isu Jet Pribadi dan Lampu Pocong Saat Debat,REGIONAL
Lirik dan Chord Lagu You Know What They Do to Guys Like Us in Prison – My Chemical Romance,HYPE
Lirik dan Chord Lagu The Jetset Life is Gonna Kill You – My Chemical Romance,HYPE
Apa Saja yang Harus Dibawa ke TPS saat Akan Mencoblos di Pilkada 2024?,REGIONAL
Lirik dan Chord Lagu Hang ‘Em High – My Chemical Romance,HYPE
Kronologi Ibu dan Anak di Bekasi Tewas Tertabrak Mobil Boks Usai Gagal Menyalip,NEWS
Tujuan Pokok Sistem Komputer beserta Pengertiannya,SKOLA
Lirik dan Chord Lagu To the End – My Chemical Romance,HYPE
"Menuju Toraja Utara, Wapres Gibran Bagikan Susu, Buku, dan Peralatan Sekolah di Jalan",REGIONAL
"Elon Musk Peroleh Jabatan Khusus di Pemerintahan Trump, Apa Perannya?",MONEY
"Diduga Saling Ledek, Pendukung Antar Paslon di Buton Tengah Ricuh Saat Debat",REGIONAL
Ekonomi Kreatif Harus Didukung Sebagai Mesin Pertumbuhan Baru untuk Ekonomi Nasional,MONEY
"Belum Dievakuasi, 602 Wisatawan Masih Tertahan di Labuan Bajo",TRAVEL
Langkah yang Dilakukan Rasulullah dalam Membangun Madinah,STORI
"Debat Terakhir Pilgub Sumut, Edy Rahmayadi Sebut Pimpinan Harus Pegang Teguh Aturan",REGIONAL
Galon AMDK Terstandarisasi Dinilai Tak Perlu Pelabelan BPA,MONEY
"Arafah Rianti Disebut Dilabrak Tetangga Perkara Parkiran, Ketua RT: Cuma Dengar Kabar Burung",NEWS
Debat Makin Panas Saat Wakil Edy Serang Bobby Nasution soal Isu Naik Jet Pribadi,REGIONAL
Suswono Komitmen Jadikan Jakarta Kota Ramah Disabilitas,NEWS
Kejari Ponorogo Selidiki Dugaan Penyalahgunaan Dana BOS di SMK 2 PGRI,REGIONAL
"Buka Debat, Bobby-Surya Singgung Kolaborasi Anggaran dan Intenet Gratis",REGIONAL
"Motornya Gagal Dirampas Begal, Pedagang Nasi Goreng di Bogor Dibacok di Lutut",NEWS
"Serang Bobby Saat Debat, Wakil Edy: Katanya Perencanaan Baik, Lampu Pocong Gimana?",REGIONAL
"Tentara RI dan Australia Latihan Bersama di Pantai Banongan, Situbondo",REGIONAL
"Lirik dan Chord Lagu Honey, This Mirror Isn’t Big Enough for the Two of Us – My Chemical Romance",HYPE
BPJS Kesehatan Jamin Pembayaran Rumah Sakit Aman Meski Ada Risiko Defisit,MONEY
"Arca Candi Borobudur: Jumlah, Jenis, Letak, dan Mitos Kunto Bimo",REGIONAL
"Rumah Budi Daya Ganja di Cengkareng Digerebek Polisi, Satu Pelaku Ditangkap",NEWS
Lirik dan Chord Lagu Vampires Will Never Hurt You – My Chemical Romance,HYPE
"Kebijakan Bebas Bea Masuk Susu Impor Dikritisi, Wamendag: Kita Lihat Dulu...",MONEY
Lirik dan Chord Lagu Skylines and Turnstiles – My Chemical Romance,HYPE
"Cegah KLB Penyakit Infeksi, IDAI Imbau Anak Divaksin Lengkap",HEALTH
"Erupsi Lewotobi, Pesanan Kamar Hotel di Labuan Bajo Batal, Pengusaha Merugi",REGIONAL
"Viral, Siswa SMA di Surabaya Disuruh Bersujud dan Menggonggong",REGIONAL
4 Makanan Ringan yang Sehat dan Beri Kenyang Lebih Lama,FOOD
"Ruang Kerja Ketua DPRD Kota Ambon Dibobol, Polisi Belum Temukan Motif",REGIONAL
Tanggal 14 November 2024 Memperingati Hari Apa?,NEWS
"Tanggapi Usul Ikan Kaleng Masuk Program Makan Bergizi, Aprindo: Harus yang Sehat !",MONEY
"Diparkir di Depan Salon Kota Bogor, Mobil Pikap Hilang Digasak Komplotan Maling",NEWS
KPK Dukung Penundaan Bansos Jelang Pilkada 2024 untuk Cegah Korupsi,NEWS
"Balas Sindiran, Bobby Ingatkan Edy Pernah Minta Tolong agar Bisa Bertemu Menteri",REGIONAL
"Gara-gara Miras, 2 Pemuda Tusuk 3 Orang di Depan Mapolres Lumajang",REGIONAL
Prabowo dan Biden Sepakati Pengembangan Pendidikan Sains dan Kewirausahaan,NEWS
Black Panther 3 akan Menjadi Film Terakhir Denzel Washington Sebelum Pensiun,HYPE
"Kabar Duka, Bupati Kepulauan Seribu Junaedi Meninggal Dunia",NEWS
"Jangan Panik, Ini 3 Cara Menyelamatkan Anak Tenggelam",LIFESTYLE
Prabowo-Biden Sepakat Perluas Cakupan Latihan Militer Bersama dan Perkuat Keamanan Maritim,NEWS
"Paslon Petahana Fakfak Didiskualifikasi, KPU Cabut Hak Kampanye",REGIONAL
Rieka Roslan Ungkap Dirinya Dipecat dari The Groove Bukan Mengundurkan Diri Saat Album ke-3 Dirilis,HYPE
"Mangsa Hewan Ternak Warga Bogor, Ular Sanca Sepanjang 3 Meter Dievakuasi",NEWS
"Debat Memanas, Edy Rahmayadi Tuding Bobby Langsung Temui Menteri, Abaikan Gubernur",REGIONAL
"Penyaluran KUR Capai Rp 246,58 Triliun atau 88 Persen dari Target 2024",MONEY
Prinsa Mandagie Ceritakan Orangtuanya Menangis Saat Nonton Film Pendek Coba Jadi Aku,HYPE
"Obatnya Habis, Pria dengan Gangguan Kejiwaan di Sambas Aniaya 2 Warga, 1 Tewas",REGIONAL
KPK Sebut Laporan soal Penggunaan Jet Pribadi Bobby Nasution Diproses Dumas,NEWS
Drama Thailand Dikritik Usai Membius Kucing untuk Adegan Kematian,HYPE
"Rumah Produksi Miras Ilegal di Tangsel Digerebek Polisi, Ratusan Botol Arak Diamankan",NEWS
Bluebird Maknai Hari Pahlawan dengan Mengapresiasi Pengemudi,MONEY
Nomor WhatsApp untuk Informasi Evakuasi Wisatawan di Labuan Bajo,TRAVEL
Brankas Berisi Uang Rp 5 Miliar dan Emas 1 Kg Dicuri dari Rumah di Tangsel,NEWS
"Mengaku Jadi Pemenang Tender Pemkot Jaktim, Wanita Ini Tipu Lima Korban hingga Rp 5,8 Miliar",NEWS
"Perbaiki Mesin Pompa Air, Dua Warga Purworejo Tewas di Dalam Sumur",REGIONAL
"Dicurhati Warga yang Terjerat Rentenir dan Pinjol, Airin Berjanji Akan Tingkatkan Literasi Keuangan Masyarakat",REGIONAL
"Survei Spektrum Politika Institute, Paslon Tunggal Annisa-Leli Unggul dari Kotak Kosong di Dharmasraya",REGIONAL
"Google: AI Sudah Jadi ""Top of Mind"" Masyarakat Indonesia",MONEY
"Bos Sarana Mitra Luas (SMIL) Borong 87 Juta Saham, untuk Apa?",MONEY
"Resep Bubur Kacang Hijau, Hidangan Hangat Malam Hari",FOOD
Cara Berlibur ke Singapura dengan Anggaran Terbatas,TRAVEL
"Kabur Usai Bacok Istri, Suami di Blitar Akhirnya Ditangkap",REGIONAL
"Tangguhkan Kelulusan Bahlil sebagai Doktor, UI Akan Gelar Sidang Etik",TREN
InJourney Airports Manfaatkan AI untuk Kontrol Pemakaian Air dan Listik di Bandara-bandara Besar,MONEY
Lirik Lagu Verdilac – The Doors,HYPE
Apa Saja Manfaat dari Daun Kelor? Berikut 10 Daftarnya…,HEALTH
"Selingkuh dengan Sutton Foster, Rumah Tangga Hugh Jackman Berakhir",HYPE
Warga Jepang Berharap Timnas Indonesia Bisa Main di Piala Dunia,BOLA
Marselino Soal Timnas Jepang: Kami Belajar Banyak dari Duel di Piala Asia,BOLA
BNI Pertegas Komitmen Dorong Transisi Hijau di COP29 Azerbaijan,MONEY
Saat Istri Calon Gubernur Maluku Punguti Sampah Usai Kampanye Akbar,REGIONAL
"Banjir di Perumahan Taman Mangu Indah Tangsel Surut, Sisakan Endapan Lumpur",NEWS
Lirik Lagu The Piano Bird – The Doors,HYPE
5 Ide Menciptakan Kamar Tidur Bergaya Japandi,HOMEY
"Intip Fitur Unggulan ASUS Zenbook S 14 OLED, Laptop AI Tipis yang Cocok untuk Tunjang Produktivitas",ADVERTORIAL
Lirik Lagu The Peking King and the New York King – The Doors,HYPE
4 Ciri-ciri Makanan Latiao dari China Terkontaminasi Kata Dosen Unair,EDUKASI
"Harganya Terus Naik, CEO Indodax Yakin Bitcoin Kian Menarik",MONEY
Lirik Lagu It Slipped My Mind – The Doors,HYPE
"Pantai Cimaja di Sukabumi: Daya Tarik, Aktivitas, dan Rute",REGIONAL
Penyanyi Tanea Wallace Ungkap Detail Pesta P Diddy yang Pernah Ia Hadiri,HYPE
Rizal Mantovani Minta Marcelino Lefrandt Jadi Dark Tony Stark,HYPE
Lirik Lagu Good Rockin’ – The Doors,HYPE
"Korban Erupsi Lewotobi Melahirkan di Pengungsian, Bayi Dinamai Gibran",REGIONAL
Lirik dan Chord Lagu 4 Billion Souls – The Doors,HYPE
"3 Cara Ukur Rasio Pinggang dan Pinggul, Penting buat Diet dan Sehat",LIFESTYLE
Debat Pilkada Parigi Moutong Memanas,REGIONAL
Apakah Yatim Piatu Bisa Mendaftar BPJS Kesehatan Hanya untuk Satu Orang?,TREN
"Menpan RB Rini Sebut Rekrutmen CPNS Perlu Diperbaiki, Terutama soal Usulan Formasi",MONEY
2 Warga Banten Jadi Tersangka Usai Jual 20 Sapi Bantuan Kementerian Pertanian,REGIONAL
Sudah Ada Puluhan Pendaftar Kompetisi Mirip Nicholas Saputra,HYPE
Respons Bahlil soal Gelar Doktornya Ditangguhkan UI,MONEY
Susunan Kabinet Inti Trump: Deretan Sekutu Setia yang Siap Jalankan Kebijakan Baru AS,GLOBAL
Mees Hilgers Minta Maaf Tak Bisa Bela Timnas Indonesia,BOLA
"Kampanye di Pasar Baru Lumajang, Khofifah Borong Sayur dan Daging",REGIONAL
Iran Bangun Terowongan Pertahanan Pertama di Teheran,GLOBAL
"Luncurkan Scarlett Beauty Ecosystem, Scarlett Rangkul Era Baru Perawatan Kulit yang Adaptif dan Responsif",LIFESTYLE
"Kabel Pompa Air ""Underpass"" Kemayoran Dicuri, Polisi Dalami Dugaan Sabotase Penanganan Banjir",NEWS
"Dorong Inklusi Keuangan dan Kesetaraan Gender bagi Pelaku UMKM, Kumpul Executive Lab Forum 2024 Digelar",LESTARI
Pedagang Nasi Goreng Dibacok Begal Usai Lempar Kunci Motornya ke Semak-semak,NEWS
Nelayan Lombok Tangkap Buaya yang Berjemur di Keramba Udang,REGIONAL
"Langgar Netralitas, Camat di Bone Jadi Tersangka Tindak Pidana Pemilu",REGIONAL
"Bisakah Perpanjang SIM ""Online"" Mendekati Masa Berlaku Habis? Ini Penjelasan Satlantas",TREN
"Dukung Transisi Energi Berkelanjutan di Indonesia, PLN Fokus pada Pendanaan Hijau",NEWS
Iran Hukum Gantung Ulang Pria yang Sempat Diselamatkan 28 Detik Setelah Digantung,GLOBAL
"Paman Birin Menang Praperadilan Lawan KPK, Anggota Komisi III: Ini Koreksi Bagi Penegakan Hukum",NEWS
7 Tanaman Hias Cantik yang Cocok untuk Terarium,HOMEY
"Ditipu, TKI Asal Trenggalek Terlantar di Hongkong, Jual Rumah Orangtua untuk Biaya Berangkat",REGIONAL
Kemendagri Segera Tunjuk Plt Gubernur Kalsel Pengganti Sahbirin Noor,NEWS
"Respons Survei SMRC, Golkar Yakin Ridwan Kamil-Suswono Menang Pilkada Satu Putaran",NEWS
"Resep Klasik Cheesecake Tanpa Oven, Tambahkan Selai Stroberi",FOOD
5 Rekomendasi Tempat Wisata Saat Belibur ke Singapura,TRAVEL
"Gempi Debut Jadi Penyanyi, Siap Rilis Lagu ""Ajaib"" Ciptaan Yura Yunita dan Donne Maula",HYPE
"Belajar dari Sanksi FIFA, Timnas Indonesia Siap Disiplin di Laga Selanjutnya",BOLA
Apa Definisi Organisasi dan Seberapa Penting Bagi Pelajar?,SKOLA
Air Minum Perpipaan di Jakarta Bocor Hampir 50 Persen,PROPERTI
"Link di Kemasan Boneka Mengarah ke Situs Porno, Mattel Minta Maaf",GLOBAL
"Citi Indonesia Cetak Laba Rp 2,2 Triliun hingga September 2024",MONEY
"Uji Coba Makan Bergizi di Yogyakarta, Siswa Dapat Lauk Daging Sapi dan Susu Fortifikasi",HEALTH
Apa Saja Gejala Pneumonia pada Anak? Berikut 9 Cirinya,TREN
"344 Anak di Magetan Terjangkit Gondongan, Kasus Diprediksi Bertambah",REGIONAL
Alasan Sahbirin Noor Memutuskan Mundur sebagai Gubernur Kalsel,REGIONAL
"Elektabilitasnya Unggul dalam Survei SMRC, Rano Karno Yakin Menang Pilkada Satu Putaran",NEWS
"Bus Rombongan Pernikahan Jatuh ke Sungai Pakistan, 14 Tewas, Pengantin Wanita Selamat",GLOBAL
Anggota Komisi III Ingatkan Kejagung Tak Tebang Pilih Tangani Kasus Korupsi,NEWS
"Kisah Istri Sopir Truk Penyebab Kecelakaan Cipularang: Rindu Bertemu, Terkendala Biaya",REGIONAL
4 Cara Mengukur Lingkar Pinggang Sendiri di Rumah,LIFESTYLE
Pemkot Jakpus Rogoh Rp 48 Juta untuk Ganti Kabel Pompa Air yang Dicuri,NEWS
"Besok Sidang Guru Supriyani, Kuasa Hukum Siapkan Pembelaan 188 Halaman",REGIONAL
"Kemendagri Terbitkan Edaran, Penyaluran Bansos dari APBD Ditunda Selama Pilkada",NEWS
Melukis Harapan di Langit India Syuting di 3 Negara,HYPE
"Elektabilitasnya Unggul dalam Survei SMRC, Pramono Anung: Saya Tetap ""Fight""",NEWS
"Begal Tikam Pemuda hingga Tewas di Medan, 2 Ditangkap, 4 Masih Diburu",REGIONAL
Hasil Kumamoto Masters Japan 2024: Gregoria dan Jonatan Melaju,BOLA
Kronologi Orang Rimba Keracunan Massal Madu Kelulut di Jambi,REGIONAL
"ADB Tingkatkan Pinjaman untuk Iklim Sebesar 7,2 Miliar Dollar AS",LESTARI
Wamendagri Sebut Penyaluran Bansos Ditunda Selama Pilkada 2024 untuk Cegah Penyalahgunaan,NEWS
"Gelar Doktor Bahlil Ditangguhkan, UI Akan Lakukan Sidang Etik terhadap Potensi Pelanggaran",EDUKASI
"Ridwan Kamil: Untuk Bangun Jakarta, Setengahnya Ide Pemimpin, Sisanya Masukan Warga",NEWS
"Summarecon Membangun Hunian, Merawat Pertumbuhan Penyangga Jakarta",PROPERTI
"Merasa Kelulusannya Tak Ditangguhkan UI, Bahlil: Wisuda Saya Kan Desember",NEWS
"Dipakai Sebelum Meninggal Dunia, Jam Tangan Rolex Liam Payne Masih Belum Ditemukan",HYPE
"Bandara Tutup, 1.688 Wisatawan Naik Kapal Saat Keluar dari Labuan Bajo",TRAVEL
"Gercep Tinjau Rumah Pompa, Pj. Gubernur Teguh Tingkatkan Efektivitas Penanganan Banjir",NEWS
Kemenperin Prioritaskan Hilirisasi Logam dan Dorong Industri Intermediate,MONEY
Robot Liar yang Beradab,TREN
"Wanita Tewas di Jalan Deli Serdang, Diduga Korban Pembunuhan",REGIONAL
Ibu dan Anak di Bekasi Tewas Tertabrak Mobil Boks Usai Gagal Menyalip,NEWS
"Cara Menanam Sayur Bayam di Pot, Hemat Ruang dan Panen Terus",HOMEY
"Desersi dan Terjerat Narkoba, 2 Anggota Polres Jaktim Dipecat",NEWS
457.000 Warga Sukabumi Akan Terima Manfaat Program Makan Bergizi Gratis,REGIONAL
KPU dan Kemendagri Bahas Nasib 13.000 Pemilih Terdampak Erupsi Gunung Lewotobi,NEWS
"Keracunan Madu Hutan di Jambi, 2 Bocah Orang Rimba Tewas, 27 Terluka",REGIONAL
"Mengenal COP29, Tujuan dan Peran Indonesia di Dalamnya",TREN
"Bantah Politisasi, Jaksa Agung Pastikan Hati-Hati Usut Kasus Tom Lembong",NEWS
Bahlil Belum Tahu Isi Surat Penangguhan Kelulusan Doktor dari UI,NEWS
3 Cara Mengukur Lingkar Pinggang Tanpa Meteran,LIFESTYLE
"Imbas Pencurian Kabel, Tersisa 2 Pompa Air yang Berfungsi di ""Underpass"" Kemayoran",NEWS
"Genjot Dana Murah, BTN Optimistis Pertumbuhan DPK di Atas Industri",MONEY
Lebak Ditargetkan Jadi Penyuplai Utama Program Makan Bergizi Nasional,REGIONAL
Luna Maya Tertarik Bintangi Serial Main Api karena Tertantang Perankan Nadine,HYPE
"24 Kecamatan di Bogor Rawan Bencana Alam, Warga Diimbau Waspada",REGIONAL
"7 Napi Narkoba Kabur dari Rutan Salemba, Komisi XIII Duga Ada Keterlibatan Pihak Lain",NEWS
"Resep Tempe Kremes, Sajikan dengan Sambal Kecap",FOOD
"Kunjungi Pengungsi Erupsi Gunung Lewotobi, Menteri Maruarar Janji Bangun 2.700 Rumah",REGIONAL
HP Gaming Asus ROG Phone 9 Segera Masuk Indonesia,TEKNO
"Debut lewat Film Jurnal Risa, Prinsa Mandagie Ketagihan Akting",HYPE
"Gunung Lewotobi Alami Erupsi, Bandara di Bali dan Lombok Tetap Beroperasi",TRAVEL
"Warung Mie Aceh di Deli Serdang Diserang Geng Motor, Barang Rusak dan Pengunjung Ketakutan",REGIONAL
Dharma Pongrekun: Tidak Lama Lagi Akan Ada Pandemi...,NEWS
"Anggota DPR Dorong Lemhannas Jadi Tempat ""Penyaringan"" Calon Kepala Daerah",NEWS
"Belajar dari Kasus Bahlil Lahadalia, Mengapa Pendidikan Harus Adil dan Bebas dari Kepentingan?",NEWS
"Atasi Jakarta Tenggelam, Guru Besar UB Sarankan Pakai Sumur Injeksi",PROPERTI
"Lewat Entrance Musik, Pria Ini Berhasil Menebak 20 Pegulat WWE dalam 1 Menit, Pecahkan Rekor",GLOBAL
"Alexithymia, Kondisi Saat Seseorang Sulit Ungkapkan Emosi",HEALTH
"KUR Tak Masuk Program ""Pemutihan Utang"" UMKM, Ini Alasannya",MONEY
"Kisah Pembajakan Ethiopian Airlines 961, Mendarat karena Kehabisan BBM",TREN
"Jawaban Soal ""Media yang Memungkinkan Manusia Berinteraksi""",SKOLA
Kejari Ponorogo Geledah SMK 2 PGRI Terkait Dugaan Penyimpangan Dana BOS Tahun 2019-2024,REGIONAL
"Asal Usul Kota Lubuklinggau, Kisah Linggau Membuat Lubuk",REGIONAL
Lirik Lagu Hang On to Your Life – The Doors,HYPE
"Elektabilitas Pramono-Rano Unggul dalam Survei SMRC, Ridwan Kamil: Kami Terus Blusukan",NEWS
"Desak Pecat Panwascam yang Tak Netral, Massa Jebol Gerbang Bawaslu Jember",REGIONAL
"UI Tunda Penerimaan Mahasiswa Baru Prodi S3 SKSG, Buntut Kasus Bahlil",EDUKASI
"Upayakan Zero Stunting, Kota Semarang Raih Terbaik I Penilaian Kinerja Aksi Konvergensi Stunting Se-Jateng",REGIONAL
"Rencana Ombudsman RI, Permintaan Klarifikasi Ditjen Pajak, dan Harapan UD Pramono...",REGIONAL
Lirik dan Chord Lagu Wandering Musician – The Doors,HYPE
Petani Sayuran Hidroponik di Solo Raya Perluas Bisnis ke Anggota PHRI Surakarta,UMKM
[HOAKS] Puan Maharani Bagi-bagi Uang Rp 25 Juta,CEK FAKTA
"Lirik dan Chord Lagu I’m Horny, I’m Stoned – The Doors",HYPE
Rano Karno Minta Budi Arie Klarifikasi Usai Sebut Timsesnya Terlibat Kasus Judol Komdigi,NEWS
"Polemik Gelar Doktor Bahlil, Ada Apa dengan Program Doktor SKSG di UI?",NEWS
"Update Kecelakaan Beruntun di Km 92 Tol Cipularang, Polisi Dalami Penyebab Insiden",REGIONAL
Komisi III DPR Akan Bentuk Panja untuk Bahas Kasus Korupsi Besar di Kejagung,NEWS
Dewan Guru Besar UI Gelar Sidang Etik terhadap Proses Pembimbingan Bahlil sebagai Doktor,NEWS
"Ciptakan Birokrasi Bersih dan Berintegritas, Menteri Rini Sebut Pengelolaan Konflik Kepentingan Jadi Kuncinya",NEWS
"Ritual Sebelum Mengemudi, Bisa Cegah Risiko Rem Blong",OTOMOTIF
8 Tanda Perlu Mengganti Air Fryer Baru yang Tidak Boleh Diabaikan,HOMEY
Pj Gubernur Sumsel Anjurkan Warga Berwirausaha Daripada Daftar CPNS,REGIONAL
"Batal Terbang akibat Erupsi Lewotobi, Penumpang di Bandara Lombok Antre ""Refund"" Tiket",REGIONAL
"IPO Bulan Depan, Anak Usaha Adaro Ini Bakal Kumpulkan Rp 4,59 Triliun",MONEY
ADOR Tanggapi Kabar NewJeans Ancam Akhiri Kontrak Eksklusif,HYPE
"Survei SMRC: Pramono-Rano Unggul, Pilkada Jakarta 2024 Berpotensi Satu Putaran",NEWS
"Dharma Sebut BLT Bikin Masyarakat Malas, Pramono: Banyak yang Masih Butuh",NEWS
Daftar 6 Panelis Debat Kedua Pilkada Depok 2024,NEWS
"Dikeluarkan dari The Groove, Keuangan Rieka Roslan Membaik Berkat Jadi Juri AFI",HYPE
"Evaluasi SKD CPNS, Menpan-RB Rini Tekankan Pemetaan Kebutuhan Pegawai Sesuai Arah Pembangunan Nasional",NEWS
"Bamsoet Tanya soal Catatan Suap Hakim dari Penggeledahan Zarof Ricar, Kejagung: Kita Dalami",NEWS
Bandara I Gusti Ngurah Rai Tidak Terdampak Abu Vulkanik Gunung Lewotobi,TRAVEL
Indonesia Vs Jepang: Ivar Jenner Jelaskan Beda Main di Eropa dan Asia,BOLA
"Tangguhkan Kelulusan Bahlil Lahadalia sebagai Doktor, UI Minta Maaf",TREN
"Kronologi Penangkapan 2 Maling Kabel Pompa Air di Kemayoran, Berawal dari Petugas Curiga",NEWS
"Akui Ada Pegawai Main Judi ""Online"", Jaksa Agung: Hanya Iseng-Iseng",NEWS
"Istri Polisi Dilaporkan Atas Dugaan Penipuan, Modusnya Tawarkan Bisnis Pangkalan Elpiji",REGIONAL
Prinsa Mandagie Rilis Film Pendek Berjudul Coba Jadi Aku,HYPE
Sopir Truk Penyebab Kecelakaan Beruntun Tol Cipularang Baru 4 Bulan Kerja,REGIONAL
"Tuntut Pecat Penyelenggara Tak Netral, Warga Jember Demo KPU dan Bawaslu",REGIONAL
"Promo Hari Pahlawan, Servis Motor Honda Bisa Diskon 15 Persen",OTOMOTIF
BMW Pamer Motor Konsep F 450 GS,OTOMOTIF
"Gelar Doktor Bahlil Lahadalia Ditangguhkan, UI Ungkap Alasannya",TREN
